[
  {
    "id": "doc-1-_sites_g_files_vyhlif6186_f_events_2_11_26_meeting_agenda_0_pdf",
    "title": "2.11.26_meeting_agenda_0.pdf",
    "event": "Planning Board Meeting",
    "url": "https://www.ballstonspa.gov/sites/g/files/vyhlif6186/f/events/2.11.26_meeting_agenda_0.pdf",
    "date": "2026-02-11",
    "category": "Planning Board",
    "type": "Agenda",
    "pageUrl": "https://www.ballstonspa.gov/home/events/20901"
  },
  {
    "id": "doc-2-_sites_g_files_vyhlif6186_f_events_feb_10_agenda_pdf",
    "title": "feb_10_agenda.pdf",
    "event": "Historic District Commission Meeting",
    "url": "https://www.ballstonspa.gov/sites/g/files/vyhlif6186/f/events/feb_10_agenda.pdf",
    "date": "2026-02-10",
    "category": "Historic District Commission",
    "type": "Agenda",
    "pageUrl": "https://www.ballstonspa.gov/home/events/21006"
  },
  {
    "id": "doc-3-_sites_g_files_vyhlif6186_f_events_abstract_2_9_26_pdf",
    "title": "abstract_2.9.26.pdf",
    "event": "Village of Ballston Spa Board of Trustees Meeting",
    "url": "https://www.ballstonspa.gov/sites/g/files/vyhlif6186/f/events/abstract_2.9.26.pdf",
    "date": "2026-02-09",
    "category": "Board of Trustees",
    "type": "Project Document",
    "pageUrl": "https://www.ballstonspa.gov/home/events/20811"
  },
  {
    "id": "doc-4-_sites_g_files_vyhlif6186_f_events_attachments_2_9_26_pdf",
    "title": "attachments_2.9.26.pdf",
    "event": "Village of Ballston Spa Board of Trustees Meeting",
    "url": "https://www.ballstonspa.gov/sites/g/files/vyhlif6186/f/events/attachments_2.9.26.pdf",
    "date": "2026-02-09",
    "category": "Board of Trustees",
    "type": "Project Document",
    "pageUrl": "https://www.ballstonspa.gov/home/events/20811"
  },
  {
    "id": "doc-5-_sites_g_files_vyhlif6186_f_events_2_9_26_att_bspa_revitalize_presentation_pdf",
    "title": "2.9.26_att_bspa_revitalize_presentation.pdf",
    "event": "Village of Ballston Spa Board of Trustees Meeting",
    "url": "https://www.ballstonspa.gov/sites/g/files/vyhlif6186/f/events/2.9.26_att_bspa_revitalize_presentation.pdf",
    "date": "2026-02-09",
    "category": "Board of Trustees",
    "type": "Project Document",
    "pageUrl": "https://www.ballstonspa.gov/home/events/20811"
  },
  {
    "id": "doc-6-_sites_g_files_vyhlif6186_f_events_1_12_26_mtg_minutes_pdf",
    "title": "1.12.26_mtg_minutes.pdf",
    "event": "Village of Ballston Spa Board of Trustees Meeting",
    "url": "https://www.ballstonspa.gov/sites/g/files/vyhlif6186/f/events/1.12.26_mtg_minutes.pdf",
    "date": "2026-02-09",
    "category": "Board of Trustees",
    "type": "Minutes",
    "pageUrl": "https://www.ballstonspa.gov/home/events/20811"
  },
  {
    "id": "doc-7-_sites_g_files_vyhlif6186_f_events_1_26_26_minutes_pdf",
    "title": "1.26.26_minutes.pdf",
    "event": "Village of Ballston Spa Board of Trustees Meeting",
    "url": "https://www.ballstonspa.gov/sites/g/files/vyhlif6186/f/events/1.26.26_minutes.pdf",
    "date": "2026-02-09",
    "category": "Board of Trustees",
    "type": "Minutes",
    "pageUrl": "https://www.ballstonspa.gov/home/events/20811"
  },
  {
    "id": "doc-8-_sites_g_files_vyhlif6186_f_events_agenda_2_9_2026_0_pdf",
    "title": "agenda_2.9.2026_0.pdf",
    "event": "Village of Ballston Spa Board of Trustees Meeting",
    "url": "https://www.ballstonspa.gov/sites/g/files/vyhlif6186/f/events/agenda_2.9.2026_0.pdf",
    "date": "2026-02-09",
    "category": "Board of Trustees",
    "type": "Agenda",
    "pageUrl": "https://www.ballstonspa.gov/home/events/20811"
  },
  {
    "id": "doc-9-_sites_g_files_vyhlif6186_f_events_1_26_26_agenda_fsr_pdf",
    "title": "1.26.26_agenda_fsr.pdf",
    "event": "Village of Ballston Spa Board of Trustees Meeting",
    "url": "https://www.ballstonspa.gov/sites/g/files/vyhlif6186/f/events/1.26.26_agenda_fsr.pdf",
    "date": "2026-01-26",
    "category": "Board of Trustees",
    "type": "Agenda",
    "pageUrl": "https://www.ballstonspa.gov/home/events/20806"
  },
  {
    "id": "doc-10-_sites_g_files_vyhlif6186_f_events_attachments_1_26_26_pdf",
    "title": "attachments_1.26.26.pdf",
    "event": "Village of Ballston Spa Board of Trustees Meeting",
    "url": "https://www.ballstonspa.gov/sites/g/files/vyhlif6186/f/events/attachments_1.26.26.pdf",
    "date": "2026-01-26",
    "category": "Board of Trustees",
    "type": "Project Document",
    "pageUrl": "https://www.ballstonspa.gov/home/events/20806"
  },
  {
    "id": "doc-11-_sites_g_files_vyhlif6186_f_events_1_12_26_draft_minutes_for_1_26_26_mtg_pdf",
    "title": "1.12.26_draft_minutes_for_1.26.26_mtg.pdf",
    "event": "Village of Ballston Spa Board of Trustees Meeting",
    "url": "https://www.ballstonspa.gov/sites/g/files/vyhlif6186/f/events/1.12.26_draft_minutes_for_1.26.26_mtg.pdf",
    "date": "2026-01-26",
    "category": "Board of Trustees",
    "type": "Minutes",
    "pageUrl": "https://www.ballstonspa.gov/home/events/20806"
  },
  {
    "id": "doc-12-_sites_g_files_vyhlif6186_f_events_abstract_1_26_26_pdf",
    "title": "abstract_1.26.26.pdf",
    "event": "Village of Ballston Spa Board of Trustees Meeting",
    "url": "https://www.ballstonspa.gov/sites/g/files/vyhlif6186/f/events/abstract_1.26.26.pdf",
    "date": "2026-01-26",
    "category": "Board of Trustees",
    "type": "Project Document",
    "pageUrl": "https://www.ballstonspa.gov/home/events/20806"
  },
  {
    "id": "doc-13-_sites_g_files_vyhlif6186_f_events_attachments_1_26_26b_pdf",
    "title": "attachments_1.26.26b.pdf",
    "event": "Village of Ballston Spa Board of Trustees Meeting",
    "url": "https://www.ballstonspa.gov/sites/g/files/vyhlif6186/f/events/attachments_1.26.26b.pdf",
    "date": "2026-01-26",
    "category": "Board of Trustees",
    "type": "Project Document",
    "pageUrl": "https://www.ballstonspa.gov/home/events/20806"
  },
  {
    "id": "doc-14-_sites_g_files_vyhlif6186_f_events_agenda_-_committee_meeting_6_pdf",
    "title": "agenda_-_committee_meeting_6.pdf",
    "event": "BOA Steering Committee Meeting",
    "url": "https://www.ballstonspa.gov/sites/g/files/vyhlif6186/f/events/agenda_-_committee_meeting_6.pdf",
    "date": "2026-01-22",
    "category": "BOA Steering Committee",
    "type": "Agenda",
    "pageUrl": "https://www.ballstonspa.gov/home/events/21016"
  },
  {
    "id": "doc-15-_sites_g_files_vyhlif6186_f_events_park_and_tree_agenda_1_20_26_pdf",
    "title": "park_and_tree_agenda_1.20.26.pdf",
    "event": "Park and Tree Meeting",
    "url": "https://www.ballstonspa.gov/sites/g/files/vyhlif6186/f/events/park_and_tree_agenda_1.20.26.pdf",
    "date": "2026-01-20",
    "category": "Park and Tree",
    "type": "Agenda",
    "pageUrl": "https://www.ballstonspa.gov/home/events/20771"
  },
  {
    "id": "doc-16-_sites_g_files_vyhlif6186_f_events_park_and_tree_minutes_12_16_25_pdf",
    "title": "park_and_tree_minutes_12.16.25.pdf",
    "event": "Park and Tree Meeting",
    "url": "https://www.ballstonspa.gov/sites/g/files/vyhlif6186/f/events/park_and_tree_minutes_12.16.25.pdf",
    "date": "2026-01-20",
    "category": "Park and Tree",
    "type": "Minutes",
    "pageUrl": "https://www.ballstonspa.gov/home/events/20771"
  },
  {
    "id": "doc-17-_sites_g_files_vyhlif6186_f_events_11_12_2025_meeting_minutes_pdf",
    "title": "11.12.2025_meeting_minutes.pdf",
    "event": "Committee on the Arts Meeting",
    "url": "https://www.ballstonspa.gov/sites/g/files/vyhlif6186/f/events/11.12.2025_meeting_minutes.pdf",
    "date": "2026-01-14",
    "category": "Committee on the Arts",
    "type": "Minutes",
    "pageUrl": "https://www.ballstonspa.gov/home/events/20826"
  },
  {
    "id": "doc-18-_sites_g_files_vyhlif6186_f_events_1_14_2026_meeting_agenda_pdf",
    "title": "1.14.2026_meeting_agenda.pdf",
    "event": "Committee on the Arts Meeting",
    "url": "https://www.ballstonspa.gov/sites/g/files/vyhlif6186/f/events/1.14.2026_meeting_agenda.pdf",
    "date": "2026-01-14",
    "category": "Committee on the Arts",
    "type": "Agenda",
    "pageUrl": "https://www.ballstonspa.gov/home/events/20826"
  },
  {
    "id": "doc-19-_sites_g_files_vyhlif6186_f_events_1_14_26_meeting_agenda_pdf",
    "title": "1.14.26_meeting_agenda.pdf",
    "event": "Planning Board Meeting",
    "url": "https://www.ballstonspa.gov/sites/g/files/vyhlif6186/f/events/1.14.26_meeting_agenda.pdf",
    "date": "2026-01-14",
    "category": "Planning Board",
    "type": "Agenda",
    "pageUrl": "https://www.ballstonspa.gov/home/events/20711"
  },
  {
    "id": "doc-20-_sites_g_files_vyhlif6186_f_events_hdc_jan_13_26_agenda_pdf",
    "title": "hdc_jan_13_26_agenda.pdf",
    "event": "HDC Meeting",
    "url": "https://www.ballstonspa.gov/sites/g/files/vyhlif6186/f/events/hdc_jan_13_26_agenda.pdf",
    "date": "2026-01-13",
    "category": "Historic District Commission",
    "type": "Agenda",
    "pageUrl": "https://www.ballstonspa.gov/home/events/20756"
  },
  {
    "id": "doc-21-_sites_g_files_vyhlif6186_f_events_agenda_1-12-26_fsr_pdf",
    "title": "agenda_1-12-26_fsr.pdf",
    "event": "Village of Ballston Spa Board of Trustees Meeting",
    "url": "https://www.ballstonspa.gov/sites/g/files/vyhlif6186/f/events/agenda_1-12-26_fsr.pdf",
    "date": "2026-01-12",
    "category": "Board of Trustees",
    "type": "Agenda",
    "pageUrl": "https://www.ballstonspa.gov/home/events/20421"
  },
  {
    "id": "doc-22-_files_vyhlif6186_f_events_draft_meeting_minutes_for_12_8_25-1_1_26_meetings_pdf",
    "title": "draft_meeting_minutes_for_12.8.25-1.1.26_meetings.pdf",
    "event": "Village of Ballston Spa Board of Trustees Meeting",
    "url": "https://www.ballstonspa.gov/sites/g/files/vyhlif6186/f/events/draft_meeting_minutes_for_12.8.25-1.1.26_meetings.pdf",
    "date": "2026-01-12",
    "category": "Board of Trustees",
    "type": "Minutes",
    "pageUrl": "https://www.ballstonspa.gov/home/events/20421"
  },
  {
    "id": "doc-23-_sites_g_files_vyhlif6186_f_events_1_12_26_abstract_pdf",
    "title": "1.12.26_abstract.pdf",
    "event": "Village of Ballston Spa Board of Trustees Meeting",
    "url": "https://www.ballstonspa.gov/sites/g/files/vyhlif6186/f/events/1.12.26_abstract.pdf",
    "date": "2026-01-12",
    "category": "Board of Trustees",
    "type": "Project Document",
    "pageUrl": "https://www.ballstonspa.gov/home/events/20421"
  },
  {
    "id": "doc-24-_sites_g_files_vyhlif6186_f_events_1_12_26_attachments_pdf",
    "title": "1.12.26_attachments.pdf",
    "event": "Village of Ballston Spa Board of Trustees Meeting",
    "url": "https://www.ballstonspa.gov/sites/g/files/vyhlif6186/f/events/1.12.26_attachments.pdf",
    "date": "2026-01-12",
    "category": "Board of Trustees",
    "type": "Project Document",
    "pageUrl": "https://www.ballstonspa.gov/home/events/20421"
  },
  {
    "id": "doc-25-_sites_g_files_vyhlif6186_f_events_att_1-1-2026_pdf",
    "title": "att_1-1-2026.pdf",
    "event": "Village of Ballston Spa Organizational Meeting",
    "url": "https://www.ballstonspa.gov/sites/g/files/vyhlif6186/f/events/att_1-1-2026.pdf",
    "date": "2026-01-01",
    "category": "Board of Trustees",
    "type": "Project Document",
    "pageUrl": "https://www.ballstonspa.gov/home/events/20356"
  },
  {
    "id": "doc-26-_sites_g_files_vyhlif6186_f_events_agenda_1_1_26_fsr_pdf",
    "title": "agenda_1.1.26_fsr.pdf",
    "event": "Village of Ballston Spa Organizational Meeting",
    "url": "https://www.ballstonspa.gov/sites/g/files/vyhlif6186/f/events/agenda_1.1.26_fsr.pdf",
    "date": "2026-01-01",
    "category": "Board of Trustees",
    "type": "Agenda",
    "pageUrl": "https://www.ballstonspa.gov/home/events/20356"
  },
  {
    "id": "doc-27-_sites_g_files_vyhlif6186_f_events_park_and_tree_agenda_12_16_25_pdf",
    "title": "park_and_tree_agenda_12.16.25.pdf",
    "event": "Park and Tree Meeting",
    "url": "https://www.ballstonspa.gov/sites/g/files/vyhlif6186/f/events/park_and_tree_agenda_12.16.25.pdf",
    "date": "2025-12-16",
    "category": "Park and Tree",
    "type": "Agenda",
    "pageUrl": "https://www.ballstonspa.gov/home/events/20346"
  },
  {
    "id": "doc-28-_sites_g_files_vyhlif6186_f_events_agenda_12_15_25_-_fsr_pdf",
    "title": "agenda_12.15.25_-_fsr.pdf",
    "event": "Special Board of Trustees Meeting",
    "url": "https://www.ballstonspa.gov/sites/g/files/vyhlif6186/f/events/agenda_12.15.25_-_fsr.pdf",
    "date": "2025-12-15",
    "category": "Board of Trustees",
    "type": "Agenda",
    "pageUrl": "https://www.ballstonspa.gov/home/events/20326"
  },
  {
    "id": "doc-29-_sites_g_files_vyhlif6186_f_events_12-15-25_att_pdf",
    "title": "12-15-25_att.pdf",
    "event": "Special Board of Trustees Meeting",
    "url": "https://www.ballstonspa.gov/sites/g/files/vyhlif6186/f/events/12-15-25_att.pdf",
    "date": "2025-12-15",
    "category": "Board of Trustees",
    "type": "Project Document",
    "pageUrl": "https://www.ballstonspa.gov/home/events/20326"
  },
  {
    "id": "doc-30-_sites_g_files_vyhlif6186_f_events_12_10_2025_meeting_agenda_pdf",
    "title": "12.10.2025_meeting_agenda.pdf",
    "event": "Postponed !!! Arts Committee Meeting",
    "url": "https://www.ballstonspa.gov/sites/g/files/vyhlif6186/f/events/12.10.2025_meeting_agenda.pdf",
    "date": "2025-12-10",
    "category": "Committee on the Arts",
    "type": "Agenda",
    "pageUrl": "https://www.ballstonspa.gov/home/events/20151"
  },
  {
    "id": "doc-31-_sites_g_files_vyhlif6186_f_events_12_10_25_meeting_agenda_pdf",
    "title": "12.10.25_meeting_agenda.pdf",
    "event": "Planning Board Meeting",
    "url": "https://www.ballstonspa.gov/sites/g/files/vyhlif6186/f/events/12.10.25_meeting_agenda.pdf",
    "date": "2025-12-10",
    "category": "Planning Board",
    "type": "Agenda",
    "pageUrl": "https://www.ballstonspa.gov/home/events/19921"
  },
  {
    "id": "doc-32-_sites_g_files_vyhlif6186_f_events_info_packet_87_front_st_bsnb_signs_pdf",
    "title": "info_packet_87_front_st_bsnb_signs.pdf",
    "event": "Planning Board Meeting",
    "url": "https://www.ballstonspa.gov/sites/g/files/vyhlif6186/f/events/info_packet_87_front_st_bsnb_signs.pdf",
    "date": "2025-12-10",
    "category": "Planning Board",
    "type": "Project Document",
    "pageUrl": "https://www.ballstonspa.gov/home/events/19921"
  },
  {
    "id": "doc-33-_sites_g_files_vyhlif6186_f_events_12_08_25_att_pdf",
    "title": "12.08.25_att.pdf",
    "event": "Village of Ballston Spa Board of Trustees Meeting",
    "url": "https://www.ballstonspa.gov/sites/g/files/vyhlif6186/f/events/12.08.25_att.pdf",
    "date": "2025-12-08",
    "category": "Board of Trustees",
    "type": "Project Document",
    "pageUrl": "https://www.ballstonspa.gov/home/events/20241"
  },
  {
    "id": "doc-34-_sites_g_files_vyhlif6186_f_events_agenda_12_08_25_-_fsr_pdf",
    "title": "agenda_12.08.25_-_fsr.pdf",
    "event": "Village of Ballston Spa Board of Trustees Meeting",
    "url": "https://www.ballstonspa.gov/sites/g/files/vyhlif6186/f/events/agenda_12.08.25_-_fsr.pdf",
    "date": "2025-12-08",
    "category": "Board of Trustees",
    "type": "Agenda",
    "pageUrl": "https://www.ballstonspa.gov/home/events/20241"
  },
  {
    "id": "doc-35-_sites_g_files_vyhlif6186_f_events_bd__mtg__11_24_25_0_pdf",
    "title": "bd._mtg._11.24.25_0.pdf",
    "event": "Village of Ballston Spa Board of Trustees Meeting",
    "url": "https://www.ballstonspa.gov/sites/g/files/vyhlif6186/f/events/bd._mtg._11.24.25_0.pdf",
    "date": "2025-12-08",
    "category": "Board of Trustees",
    "type": "Minutes",
    "pageUrl": "https://www.ballstonspa.gov/home/events/20241"
  },
  {
    "id": "doc-36-_vyhlif6186_f_events_site_plan_review_checklist_galway_lot_line_adjustment_1_pdf",
    "title": "site_plan_review_checklist_galway_lot_line_adjustment_1.pdf",
    "event": "Zoning Board of Appeals Meeting",
    "url": "https://www.ballstonspa.gov/sites/g/files/vyhlif6186/f/events/site_plan_review_checklist_galway_lot_line_adjustment_1.pdf",
    "date": "2025-12-03",
    "category": "Zoning Board",
    "type": "Project Document",
    "pageUrl": "https://www.ballstonspa.gov/home/events/19916"
  },
  {
    "id": "doc-37-_sites_g_files_vyhlif6186_f_events_galway_st_subdivision_application__0_pdf",
    "title": "galway_st_subdivision_application__0.pdf",
    "event": "Zoning Board of Appeals Meeting",
    "url": "https://www.ballstonspa.gov/sites/g/files/vyhlif6186/f/events/galway_st_subdivision_application__0.pdf",
    "date": "2025-12-03",
    "category": "Zoning Board",
    "type": "Project Document",
    "pageUrl": "https://www.ballstonspa.gov/home/events/19916"
  },
  {
    "id": "doc-38-_sites_g_files_vyhlif6186_f_events_108000-site_plan_checklist_0_pdf",
    "title": "108000-site_plan_checklist_0.pdf",
    "event": "Zoning Board of Appeals Meeting",
    "url": "https://www.ballstonspa.gov/sites/g/files/vyhlif6186/f/events/108000-site_plan_checklist_0.pdf",
    "date": "2025-12-03",
    "category": "Zoning Board",
    "type": "Project Document",
    "pageUrl": "https://www.ballstonspa.gov/home/events/19916"
  },
  {
    "id": "doc-39-_sites_g_files_vyhlif6186_f_events_108000-site_plan_application_0_pdf",
    "title": "108000-site_plan_application_0.pdf",
    "event": "Zoning Board of Appeals Meeting",
    "url": "https://www.ballstonspa.gov/sites/g/files/vyhlif6186/f/events/108000-site_plan_application_0.pdf",
    "date": "2025-12-03",
    "category": "Zoning Board",
    "type": "Project Document",
    "pageUrl": "https://www.ballstonspa.gov/home/events/19916"
  },
  {
    "id": "doc-40-_sites_g_files_vyhlif6186_f_events_108000-seaf_0_pdf",
    "title": "108000-seaf_0.pdf",
    "event": "Zoning Board of Appeals Meeting",
    "url": "https://www.ballstonspa.gov/sites/g/files/vyhlif6186/f/events/108000-seaf_0.pdf",
    "date": "2025-12-03",
    "category": "Zoning Board",
    "type": "Project Document",
    "pageUrl": "https://www.ballstonspa.gov/home/events/19916"
  },
  {
    "id": "doc-41-_sites_g_files_vyhlif6186_f_events_108000-concept_layout_0_pdf",
    "title": "108000-concept_layout_0.pdf",
    "event": "Zoning Board of Appeals Meeting",
    "url": "https://www.ballstonspa.gov/sites/g/files/vyhlif6186/f/events/108000-concept_layout_0.pdf",
    "date": "2025-12-03",
    "category": "Zoning Board",
    "type": "Project Document",
    "pageUrl": "https://www.ballstonspa.gov/home/events/19916"
  },
  {
    "id": "doc-42-_sites_g_files_vyhlif6186_f_events_108000-2025_10_7-project_narrative_0_pdf",
    "title": "108000-2025_10_7-project_narrative_0.pdf",
    "event": "Zoning Board of Appeals Meeting",
    "url": "https://www.ballstonspa.gov/sites/g/files/vyhlif6186/f/events/108000-2025_10_7-project_narrative_0.pdf",
    "date": "2025-12-03",
    "category": "Zoning Board",
    "type": "Project Document",
    "pageUrl": "https://www.ballstonspa.gov/home/events/19916"
  },
  {
    "id": "doc-43-_sites_g_files_vyhlif6186_f_events_12_3_25_zba_agenda_0_pdf",
    "title": "12.3.25_zba_agenda_0.pdf",
    "event": "Zoning Board of Appeals Meeting",
    "url": "https://www.ballstonspa.gov/sites/g/files/vyhlif6186/f/events/12.3.25_zba_agenda_0.pdf",
    "date": "2025-12-03",
    "category": "Zoning Board",
    "type": "Agenda",
    "pageUrl": "https://www.ballstonspa.gov/home/events/19916"
  },
  {
    "id": "doc-44-_sites_g_files_vyhlif6186_f_events_1080_00_l_l_a_cert_25-10-2_0_pdf",
    "title": "1080.00_l.l.a.cert_25-10-2_0.pdf",
    "event": "Zoning Board of Appeals Meeting",
    "url": "https://www.ballstonspa.gov/sites/g/files/vyhlif6186/f/events/1080.00_l.l.a.cert_25-10-2_0.pdf",
    "date": "2025-12-03",
    "category": "Zoning Board",
    "type": "Project Document",
    "pageUrl": "https://www.ballstonspa.gov/home/events/19916"
  },
  {
    "id": "doc-45-_sites_g_files_vyhlif6186_f_events_zoning_area_application_11-4-2025_tacy_0_pdf",
    "title": "zoning_area_application_11-4-2025_tacy_0.pdf",
    "event": "Zoning Board of Appeals Meeting",
    "url": "https://www.ballstonspa.gov/sites/g/files/vyhlif6186/f/events/zoning_area_application_11-4-2025_tacy_0.pdf",
    "date": "2025-12-03",
    "category": "Zoning Board",
    "type": "Project Document",
    "pageUrl": "https://www.ballstonspa.gov/home/events/19916"
  },
  {
    "id": "doc-46-_sites_g_files_vyhlif6186_f_events_info_packet_17_east_high_street_-_maas_0_pdf",
    "title": "info_packet_17_east_high_street_-_maas_0.pdf",
    "event": "Zoning Board of Appeals Meeting",
    "url": "https://www.ballstonspa.gov/sites/g/files/vyhlif6186/f/events/info_packet_17_east_high_street_-_maas_0.pdf",
    "date": "2025-12-03",
    "category": "Zoning Board",
    "type": "Project Document",
    "pageUrl": "https://www.ballstonspa.gov/home/events/19916"
  },
  {
    "id": "doc-47-_sites_g_files_vyhlif6186_f_events_agenda-11_25_25_copy_pdf",
    "title": "agenda-11.25.25_copy.pdf",
    "event": "Ethics Board Meeting",
    "url": "https://www.ballstonspa.gov/sites/g/files/vyhlif6186/f/events/agenda-11.25.25_copy.pdf",
    "date": "2025-11-25",
    "category": "Ethics Board",
    "type": "Agenda",
    "pageUrl": "https://www.ballstonspa.gov/home/events/20041"
  },
  {
    "id": "doc-48-_sites_g_files_vyhlif6186_f_events_11_24_25_att_pdf",
    "title": "11.24.25_att.pdf",
    "event": "Village of Ballston Spa Board of Trustees Meeting",
    "url": "https://www.ballstonspa.gov/sites/g/files/vyhlif6186/f/events/11.24.25_att.pdf",
    "date": "2025-11-24",
    "category": "Board of Trustees",
    "type": "Project Document",
    "pageUrl": "https://www.ballstonspa.gov/home/events/19971"
  },
  {
    "id": "doc-49-_sites_g_files_vyhlif6186_f_events_bd__mtg__11_10_25_pdf",
    "title": "bd._mtg._11.10.25.pdf",
    "event": "Village of Ballston Spa Board of Trustees Meeting",
    "url": "https://www.ballstonspa.gov/sites/g/files/vyhlif6186/f/events/bd._mtg._11.10.25.pdf",
    "date": "2025-11-24",
    "category": "Board of Trustees",
    "type": "Minutes",
    "pageUrl": "https://www.ballstonspa.gov/home/events/19971"
  },
  {
    "id": "doc-50-_sites_g_files_vyhlif6186_f_events_agenda_11_24_25_fsr_pdf",
    "title": "agenda_11.24.25_fsr.pdf",
    "event": "Village of Ballston Spa Board of Trustees Meeting",
    "url": "https://www.ballstonspa.gov/sites/g/files/vyhlif6186/f/events/agenda_11.24.25_fsr.pdf",
    "date": "2025-11-24",
    "category": "Board of Trustees",
    "type": "Agenda",
    "pageUrl": "https://www.ballstonspa.gov/home/events/19971"
  },
  {
    "id": "doc-51-_sites_g_files_vyhlif6186_f_events_bspa_boa_workshop_flyer_workshop_2_flyer_pdf",
    "title": "bspa_boa_workshop_flyer_workshop_2_flyer.pdf",
    "event": "Revitalize Ballston Spa Public Workshop",
    "url": "https://www.ballstonspa.gov/sites/g/files/vyhlif6186/f/events/bspa_boa_workshop_flyer_workshop_2_flyer.pdf",
    "date": "2025-11-20",
    "category": "BOA Steering Committee",
    "type": "Project Document",
    "pageUrl": "https://www.ballstonspa.gov/home/events/18941"
  },
  {
    "id": "doc-52-_sites_g_files_vyhlif6186_f_events_park_and_tree_agenda_11_18_25_pdf",
    "title": "park_and_tree_agenda_11.18.25.pdf",
    "event": "Park and Tree Meeting",
    "url": "https://www.ballstonspa.gov/sites/g/files/vyhlif6186/f/events/park_and_tree_agenda_11.18.25.pdf",
    "date": "2025-11-18",
    "category": "Park and Tree",
    "type": "Agenda",
    "pageUrl": "https://www.ballstonspa.gov/home/events/19936"
  },
  {
    "id": "doc-53-_sites_g_files_vyhlif6186_f_events_11_12_25_meeting_agenda_pdf",
    "title": "11.12.25_meeting_agenda.pdf",
    "event": "Planning Board Meeting",
    "url": "https://www.ballstonspa.gov/sites/g/files/vyhlif6186/f/events/11.12.25_meeting_agenda.pdf",
    "date": "2025-11-12",
    "category": "Planning Board",
    "type": "Agenda",
    "pageUrl": "https://www.ballstonspa.gov/home/events/19331"
  },
  {
    "id": "doc-54-_sites_g_files_vyhlif6186_f_events_tacy_subdivision_rev_10-7-25_0_pdf",
    "title": "tacy_subdivision_rev_10-7-25_0.pdf",
    "event": "Planning Board Meeting",
    "url": "https://www.ballstonspa.gov/sites/g/files/vyhlif6186/f/events/tacy_subdivision_rev_10-7-25_0.pdf",
    "date": "2025-11-12",
    "category": "Planning Board",
    "type": "Project Document",
    "pageUrl": "https://www.ballstonspa.gov/home/events/19331"
  },
  {
    "id": "doc-55-_sites_g_files_vyhlif6186_f_events_washington_st_subdivision_application__0_pdf",
    "title": "washington_st_subdivision_application__0.pdf",
    "event": "Planning Board Meeting",
    "url": "https://www.ballstonspa.gov/sites/g/files/vyhlif6186/f/events/washington_st_subdivision_application__0.pdf",
    "date": "2025-11-12",
    "category": "Planning Board",
    "type": "Project Document",
    "pageUrl": "https://www.ballstonspa.gov/home/events/19331"
  },
  {
    "id": "doc-56-_sites_g_files_vyhlif6186_f_events_scan_pdf",
    "title": "scan.pdf",
    "event": "Planning Board Meeting",
    "url": "https://www.ballstonspa.gov/sites/g/files/vyhlif6186/f/events/scan.pdf",
    "date": "2025-11-12",
    "category": "Planning Board",
    "type": "Project Document",
    "pageUrl": "https://www.ballstonspa.gov/home/events/19331"
  },
  {
    "id": "doc-57-_sites_g_files_vyhlif6186_f_events_11-10-2025_att_2_of_2_pdf",
    "title": "11-10-2025_att_2_of_2.pdf",
    "event": "Village of Ballston Spa Board of Trustees Meeting",
    "url": "https://www.ballstonspa.gov/sites/g/files/vyhlif6186/f/events/11-10-2025_att_2_of_2.pdf",
    "date": "2025-11-10",
    "category": "Board of Trustees",
    "type": "Project Document",
    "pageUrl": "https://www.ballstonspa.gov/home/events/19521"
  },
  {
    "id": "doc-58-_sites_g_files_vyhlif6186_f_events_11-10-2025_att_1_of_2_pdf",
    "title": "11-10-2025_att_1_of_2.pdf",
    "event": "Village of Ballston Spa Board of Trustees Meeting",
    "url": "https://www.ballstonspa.gov/sites/g/files/vyhlif6186/f/events/11-10-2025_att_1_of_2.pdf",
    "date": "2025-11-10",
    "category": "Board of Trustees",
    "type": "Project Document",
    "pageUrl": "https://www.ballstonspa.gov/home/events/19521"
  },
  {
    "id": "doc-59-_sites_g_files_vyhlif6186_f_events_bd__mtg__10_27_25_pdf",
    "title": "bd._mtg._10.27.25.pdf",
    "event": "Village of Ballston Spa Board of Trustees Meeting",
    "url": "https://www.ballstonspa.gov/sites/g/files/vyhlif6186/f/events/bd._mtg._10.27.25.pdf",
    "date": "2025-11-10",
    "category": "Board of Trustees",
    "type": "Minutes",
    "pageUrl": "https://www.ballstonspa.gov/home/events/19521"
  },
  {
    "id": "doc-60-_sites_g_files_vyhlif6186_f_events_special_mtg__10_27_25_pdf",
    "title": "special_mtg._10.27.25.pdf",
    "event": "Village of Ballston Spa Board of Trustees Meeting",
    "url": "https://www.ballstonspa.gov/sites/g/files/vyhlif6186/f/events/special_mtg._10.27.25.pdf",
    "date": "2025-11-10",
    "category": "Board of Trustees",
    "type": "Minutes",
    "pageUrl": "https://www.ballstonspa.gov/home/events/19521"
  },
  {
    "id": "doc-61-_sites_g_files_vyhlif6186_f_events_agenda_11_10_25_fsr_amended_pdf",
    "title": "agenda_11.10.25_fsr_amended.pdf",
    "event": "Village of Ballston Spa Board of Trustees Meeting",
    "url": "https://www.ballstonspa.gov/sites/g/files/vyhlif6186/f/events/agenda_11.10.25_fsr_amended.pdf",
    "date": "2025-11-10",
    "category": "Board of Trustees",
    "type": "Agenda",
    "pageUrl": "https://www.ballstonspa.gov/home/events/19521"
  },
  {
    "id": "doc-62-_sites_g_files_vyhlif6186_f_events_2026_bspa_fiscal_sponsorhip_projects_pdf",
    "title": "2026_bspa_fiscal_sponsorhip_projects.pdf",
    "event": "Village of Ballston Spa Board of Trustees Meeting",
    "url": "https://www.ballstonspa.gov/sites/g/files/vyhlif6186/f/events/2026_bspa_fiscal_sponsorhip_projects.pdf",
    "date": "2025-11-10",
    "category": "Board of Trustees",
    "type": "Project Document",
    "pageUrl": "https://www.ballstonspa.gov/home/events/19521"
  },
  {
    "id": "doc-63-_sites_g_files_vyhlif6186_f_events_11-10-2025_att_2_of_2_pdf",
    "title": "11-10-2025_att_2_of_2.pdf",
    "event": "Village of Ballston Spa Board of Trustees Meeting",
    "url": "https://www.ballstonspa.gov/sites/g/files/vyhlif6186/f/events/11-10-2025_att_2_of_2.pdf",
    "date": "2025-11-10",
    "category": "Board of Trustees",
    "type": "Project Document",
    "pageUrl": "https://www.ballstonspa.gov/home/events/19401"
  },
  {
    "id": "doc-64-_sites_g_files_vyhlif6186_f_events_11-10-2025_att_1_of_2_pdf",
    "title": "11-10-2025_att_1_of_2.pdf",
    "event": "Village of Ballston Spa Board of Trustees Meeting",
    "url": "https://www.ballstonspa.gov/sites/g/files/vyhlif6186/f/events/11-10-2025_att_1_of_2.pdf",
    "date": "2025-11-10",
    "category": "Board of Trustees",
    "type": "Project Document",
    "pageUrl": "https://www.ballstonspa.gov/home/events/19401"
  },
  {
    "id": "doc-65-_sites_g_files_vyhlif6186_f_events_bd__mtg__10_27_25_pdf",
    "title": "bd._mtg._10.27.25.pdf",
    "event": "Village of Ballston Spa Board of Trustees Meeting",
    "url": "https://www.ballstonspa.gov/sites/g/files/vyhlif6186/f/events/bd._mtg._10.27.25.pdf",
    "date": "2025-11-10",
    "category": "Board of Trustees",
    "type": "Minutes",
    "pageUrl": "https://www.ballstonspa.gov/home/events/19401"
  },
  {
    "id": "doc-66-_sites_g_files_vyhlif6186_f_events_special_mtg__10_27_25_pdf",
    "title": "special_mtg._10.27.25.pdf",
    "event": "Village of Ballston Spa Board of Trustees Meeting",
    "url": "https://www.ballstonspa.gov/sites/g/files/vyhlif6186/f/events/special_mtg._10.27.25.pdf",
    "date": "2025-11-10",
    "category": "Board of Trustees",
    "type": "Minutes",
    "pageUrl": "https://www.ballstonspa.gov/home/events/19401"
  },
  {
    "id": "doc-67-_sites_g_files_vyhlif6186_f_events_agenda_11_10_25_fsr_pdf",
    "title": "agenda_11.10.25_fsr.pdf",
    "event": "Village of Ballston Spa Board of Trustees Meeting",
    "url": "https://www.ballstonspa.gov/sites/g/files/vyhlif6186/f/events/agenda_11.10.25_fsr.pdf",
    "date": "2025-11-10",
    "category": "Board of Trustees",
    "type": "Agenda",
    "pageUrl": "https://www.ballstonspa.gov/home/events/19401"
  },
  {
    "id": "doc-68-_sites_g_files_vyhlif6186_f_events_11_6_25_zba_agenda_pdf",
    "title": "11.6.25_zba_agenda.pdf",
    "event": "Zoning Board of Appeals Meeting",
    "url": "https://www.ballstonspa.gov/sites/g/files/vyhlif6186/f/events/11.6.25_zba_agenda.pdf",
    "date": "2025-11-06",
    "category": "Zoning Board",
    "type": "Agenda",
    "pageUrl": "https://www.ballstonspa.gov/home/events/19316"
  },
  {
    "id": "doc-69-_sites_g_files_vyhlif6186_f_events_meeting_agenda_11_5_2025_pdf",
    "title": "meeting_agenda_11.5.2025.pdf",
    "event": "Committee on the Arts Meeting",
    "url": "https://www.ballstonspa.gov/sites/g/files/vyhlif6186/f/events/meeting_agenda_11.5.2025.pdf",
    "date": "2025-11-05",
    "category": "Committee on the Arts",
    "type": "Agenda",
    "pageUrl": "https://www.ballstonspa.gov/home/events/17571"
  },
  {
    "id": "doc-70-_sites_g_files_vyhlif6186_f_events_info_packet_114_south_street_jordan_pdf",
    "title": "info_packet_114_south_street_jordan.pdf",
    "event": "Zoning Board of Appeals Meeting",
    "url": "https://www.ballstonspa.gov/sites/g/files/vyhlif6186/f/events/info_packet_114_south_street_jordan.pdf",
    "date": "2025-10-29",
    "category": "Zoning Board",
    "type": "Project Document",
    "pageUrl": "https://www.ballstonspa.gov/home/events/18986"
  },
  {
    "id": "doc-71-_sites_g_files_vyhlif6186_f_events_10_29_25_zba_agenda_pdf",
    "title": "10.29.25_zba_agenda.pdf",
    "event": "Zoning Board of Appeals Meeting",
    "url": "https://www.ballstonspa.gov/sites/g/files/vyhlif6186/f/events/10.29.25_zba_agenda.pdf",
    "date": "2025-10-29",
    "category": "Zoning Board",
    "type": "Agenda",
    "pageUrl": "https://www.ballstonspa.gov/home/events/18986"
  },
  {
    "id": "doc-72-_sites_g_files_vyhlif6186_f_events_galway_st_subdivision_application__pdf",
    "title": "galway_st_subdivision_application_.pdf",
    "event": "Zoning Board of Appeals Meeting",
    "url": "https://www.ballstonspa.gov/sites/g/files/vyhlif6186/f/events/galway_st_subdivision_application_.pdf",
    "date": "2025-10-29",
    "category": "Zoning Board",
    "type": "Project Document",
    "pageUrl": "https://www.ballstonspa.gov/home/events/18986"
  },
  {
    "id": "doc-73-_sites_g_files_vyhlif6186_f_events_108000-site_vicinity_plan_pdf",
    "title": "108000-site_vicinity_plan.pdf",
    "event": "Zoning Board of Appeals Meeting",
    "url": "https://www.ballstonspa.gov/sites/g/files/vyhlif6186/f/events/108000-site_vicinity_plan.pdf",
    "date": "2025-10-29",
    "category": "Zoning Board",
    "type": "Project Document",
    "pageUrl": "https://www.ballstonspa.gov/home/events/18986"
  },
  {
    "id": "doc-74-_sites_g_files_vyhlif6186_f_events_108000-site_plan_checklist_pdf",
    "title": "108000-site_plan_checklist.pdf",
    "event": "Zoning Board of Appeals Meeting",
    "url": "https://www.ballstonspa.gov/sites/g/files/vyhlif6186/f/events/108000-site_plan_checklist.pdf",
    "date": "2025-10-29",
    "category": "Zoning Board",
    "type": "Project Document",
    "pageUrl": "https://www.ballstonspa.gov/home/events/18986"
  },
  {
    "id": "doc-75-_sites_g_files_vyhlif6186_f_events_108000-site_plan_application_pdf",
    "title": "108000-site_plan_application.pdf",
    "event": "Zoning Board of Appeals Meeting",
    "url": "https://www.ballstonspa.gov/sites/g/files/vyhlif6186/f/events/108000-site_plan_application.pdf",
    "date": "2025-10-29",
    "category": "Zoning Board",
    "type": "Project Document",
    "pageUrl": "https://www.ballstonspa.gov/home/events/18986"
  },
  {
    "id": "doc-76-_sites_g_files_vyhlif6186_f_events_108000-seaf_pdf",
    "title": "108000-seaf.pdf",
    "event": "Zoning Board of Appeals Meeting",
    "url": "https://www.ballstonspa.gov/sites/g/files/vyhlif6186/f/events/108000-seaf.pdf",
    "date": "2025-10-29",
    "category": "Zoning Board",
    "type": "Project Document",
    "pageUrl": "https://www.ballstonspa.gov/home/events/18986"
  },
  {
    "id": "doc-77-_sites_g_files_vyhlif6186_f_events_108000-concept_layout_pdf",
    "title": "108000-concept_layout.pdf",
    "event": "Zoning Board of Appeals Meeting",
    "url": "https://www.ballstonspa.gov/sites/g/files/vyhlif6186/f/events/108000-concept_layout.pdf",
    "date": "2025-10-29",
    "category": "Zoning Board",
    "type": "Project Document",
    "pageUrl": "https://www.ballstonspa.gov/home/events/18986"
  },
  {
    "id": "doc-78-_sites_g_files_vyhlif6186_f_events_108000-2025_10_7-project_narrative_pdf",
    "title": "108000-2025_10_7-project_narrative.pdf",
    "event": "Zoning Board of Appeals Meeting",
    "url": "https://www.ballstonspa.gov/sites/g/files/vyhlif6186/f/events/108000-2025_10_7-project_narrative.pdf",
    "date": "2025-10-29",
    "category": "Zoning Board",
    "type": "Project Document",
    "pageUrl": "https://www.ballstonspa.gov/home/events/18986"
  },
  {
    "id": "doc-79-_sites_g_files_vyhlif6186_f_events_1080_00_l_l_a_cert_25-10-2_pdf",
    "title": "1080.00_l.l.a.cert_25-10-2.pdf",
    "event": "Zoning Board of Appeals Meeting",
    "url": "https://www.ballstonspa.gov/sites/g/files/vyhlif6186/f/events/1080.00_l.l.a.cert_25-10-2.pdf",
    "date": "2025-10-29",
    "category": "Zoning Board",
    "type": "Project Document",
    "pageUrl": "https://www.ballstonspa.gov/home/events/18986"
  },
  {
    "id": "doc-80-tes_g_files_vyhlif6186_f_events_washington_subdivision_seqr_part_1_10_8_2025_pdf",
    "title": "washington_subdivision_seqr_part_1_10.8.2025.pdf",
    "event": "Zoning Board of Appeals Meeting",
    "url": "https://www.ballstonspa.gov/sites/g/files/vyhlif6186/f/events/washington_subdivision_seqr_part_1_10.8.2025.pdf",
    "date": "2025-10-29",
    "category": "Zoning Board",
    "type": "Project Document",
    "pageUrl": "https://www.ballstonspa.gov/home/events/18986"
  },
  {
    "id": "doc-81-_sites_g_files_vyhlif6186_f_events_washington_st_subdivision_application__pdf",
    "title": "washington_st_subdivision_application_.pdf",
    "event": "Zoning Board of Appeals Meeting",
    "url": "https://www.ballstonspa.gov/sites/g/files/vyhlif6186/f/events/washington_st_subdivision_application_.pdf",
    "date": "2025-10-29",
    "category": "Zoning Board",
    "type": "Project Document",
    "pageUrl": "https://www.ballstonspa.gov/home/events/18986"
  },
  {
    "id": "doc-82-_sites_g_files_vyhlif6186_f_events_tacy_subdivision_rev_10-7-25_pdf",
    "title": "tacy_subdivision_rev_10-7-25.pdf",
    "event": "Zoning Board of Appeals Meeting",
    "url": "https://www.ballstonspa.gov/sites/g/files/vyhlif6186/f/events/tacy_subdivision_rev_10-7-25.pdf",
    "date": "2025-10-29",
    "category": "Zoning Board",
    "type": "Project Document",
    "pageUrl": "https://www.ballstonspa.gov/home/events/18986"
  },
  {
    "id": "doc-83-_sites_g_files_vyhlif6186_f_events_tacy_seqr_part_2_washington_st_10_8_25_pdf",
    "title": "tacy_seqr_part_2_washington_st_10.8.25.pdf",
    "event": "Zoning Board of Appeals Meeting",
    "url": "https://www.ballstonspa.gov/sites/g/files/vyhlif6186/f/events/tacy_seqr_part_2_washington_st_10.8.25.pdf",
    "date": "2025-10-29",
    "category": "Zoning Board",
    "type": "Project Document",
    "pageUrl": "https://www.ballstonspa.gov/home/events/18986"
  },
  {
    "id": "doc-84-_files_vyhlif6186_f_events_site_plan_review_checklist_washington_subdivision_pdf",
    "title": "site_plan_review_checklist_washington_subdivision.pdf",
    "event": "Zoning Board of Appeals Meeting",
    "url": "https://www.ballstonspa.gov/sites/g/files/vyhlif6186/f/events/site_plan_review_checklist_washington_subdivision.pdf",
    "date": "2025-10-29",
    "category": "Zoning Board",
    "type": "Project Document",
    "pageUrl": "https://www.ballstonspa.gov/home/events/18986"
  },
  {
    "id": "doc-85-_vyhlif6186_f_events_site_plan_review_checklist_galway_lot_line_adjustment_0_pdf",
    "title": "site_plan_review_checklist_galway_lot_line_adjustment_0.pdf",
    "event": "Zoning Board of Appeals Meeting",
    "url": "https://www.ballstonspa.gov/sites/g/files/vyhlif6186/f/events/site_plan_review_checklist_galway_lot_line_adjustment_0.pdf",
    "date": "2025-10-29",
    "category": "Zoning Board",
    "type": "Project Document",
    "pageUrl": "https://www.ballstonspa.gov/home/events/18986"
  },
  {
    "id": "doc-86-s_g_files_vyhlif6186_f_events_planning_board_minutes_10_8_25_-_draft_amended_pdf",
    "title": "planning_board_minutes_10.8.25_-_draft_amended.pdf",
    "event": "Zoning Board of Appeals Meeting",
    "url": "https://www.ballstonspa.gov/sites/g/files/vyhlif6186/f/events/planning_board_minutes_10.8.25_-_draft_amended.pdf",
    "date": "2025-10-29",
    "category": "Zoning Board",
    "type": "Minutes",
    "pageUrl": "https://www.ballstonspa.gov/home/events/18986"
  },
  {
    "id": "doc-87-_sites_g_files_vyhlif6186_f_events_hdc_agenda_10_28_25_pdf",
    "title": "hdc_agenda_10.28.25.pdf",
    "event": "Historic District Commission Meeting",
    "url": "https://www.ballstonspa.gov/sites/g/files/vyhlif6186/f/events/hdc_agenda_10.28.25.pdf",
    "date": "2025-10-28",
    "category": "Historic District Commission",
    "type": "Agenda",
    "pageUrl": "https://www.ballstonspa.gov/home/events/19076"
  },
  {
    "id": "doc-88-_sites_g_files_vyhlif6186_f_events_bd__mtg__10_14_25_pdf",
    "title": "bd._mtg._10.14.25.pdf",
    "event": "Village of Ballston Spa Board of Trustees Meeting",
    "url": "https://www.ballstonspa.gov/sites/g/files/vyhlif6186/f/events/bd._mtg._10.14.25.pdf",
    "date": "2025-10-27",
    "category": "Board of Trustees",
    "type": "Minutes",
    "pageUrl": "https://www.ballstonspa.gov/home/events/19216"
  },
  {
    "id": "doc-89-_sites_g_files_vyhlif6186_f_events_agenda_10_27_25_fsr_pdf",
    "title": "agenda_10.27.25_fsr.pdf",
    "event": "Village of Ballston Spa Board of Trustees Meeting",
    "url": "https://www.ballstonspa.gov/sites/g/files/vyhlif6186/f/events/agenda_10.27.25_fsr.pdf",
    "date": "2025-10-27",
    "category": "Board of Trustees",
    "type": "Agenda",
    "pageUrl": "https://www.ballstonspa.gov/home/events/19216"
  },
  {
    "id": "doc-90-_sites_g_files_vyhlif6186_f_events_10_27_25_att_fixed_pdf",
    "title": "10.27.25_att_fixed.pdf",
    "event": "Village of Ballston Spa Board of Trustees Meeting",
    "url": "https://www.ballstonspa.gov/sites/g/files/vyhlif6186/f/events/10.27.25_att_fixed.pdf",
    "date": "2025-10-27",
    "category": "Board of Trustees",
    "type": "Project Document",
    "pageUrl": "https://www.ballstonspa.gov/home/events/19216"
  },
  {
    "id": "doc-91-_sites_g_files_vyhlif6186_f_events_park_and_tree_agenda_10_21_25_pdf",
    "title": "park_and_tree_agenda_10.21.25.pdf",
    "event": "Park and Tree Meeting",
    "url": "https://www.ballstonspa.gov/sites/g/files/vyhlif6186/f/events/park_and_tree_agenda_10.21.25.pdf",
    "date": "2025-10-21",
    "category": "Park and Tree",
    "type": "Agenda",
    "pageUrl": "https://www.ballstonspa.gov/home/events/18971"
  },
  {
    "id": "doc-92-_sites_g_files_vyhlif6186_f_events_10_15_2025_coa_meeting_agenda_pdf",
    "title": "10.15.2025_coa_meeting_agenda.pdf",
    "event": "Committee on the Arts Meeting",
    "url": "https://www.ballstonspa.gov/sites/g/files/vyhlif6186/f/events/10.15.2025_coa_meeting_agenda.pdf",
    "date": "2025-10-15",
    "category": "Committee on the Arts",
    "type": "Agenda",
    "pageUrl": "https://www.ballstonspa.gov/home/events/17606"
  },
  {
    "id": "doc-93-_sites_g_files_vyhlif6186_f_events_11-10-2025_att_2_of_2_pdf",
    "title": "11-10-2025_att_2_of_2.pdf",
    "event": "Village of Ballston Spa Board of Trustees Meeting",
    "url": "https://www.ballstonspa.gov/sites/g/files/vyhlif6186/f/events/11-10-2025_att_2_of_2.pdf",
    "date": "2025-10-14",
    "category": "Board of Trustees",
    "type": "Project Document",
    "pageUrl": "https://www.ballstonspa.gov/home/events/19461"
  },
  {
    "id": "doc-94-_sites_g_files_vyhlif6186_f_events_11-10-2025_att_1_of_2_pdf",
    "title": "11-10-2025_att_1_of_2.pdf",
    "event": "Village of Ballston Spa Board of Trustees Meeting",
    "url": "https://www.ballstonspa.gov/sites/g/files/vyhlif6186/f/events/11-10-2025_att_1_of_2.pdf",
    "date": "2025-10-14",
    "category": "Board of Trustees",
    "type": "Project Document",
    "pageUrl": "https://www.ballstonspa.gov/home/events/19461"
  },
  {
    "id": "doc-95-_sites_g_files_vyhlif6186_f_events_bd__mtg__10_27_25_pdf",
    "title": "bd._mtg._10.27.25.pdf",
    "event": "Village of Ballston Spa Board of Trustees Meeting",
    "url": "https://www.ballstonspa.gov/sites/g/files/vyhlif6186/f/events/bd._mtg._10.27.25.pdf",
    "date": "2025-10-14",
    "category": "Board of Trustees",
    "type": "Minutes",
    "pageUrl": "https://www.ballstonspa.gov/home/events/19461"
  },
  {
    "id": "doc-96-_sites_g_files_vyhlif6186_f_events_special_mtg__10_27_25_pdf",
    "title": "special_mtg._10.27.25.pdf",
    "event": "Village of Ballston Spa Board of Trustees Meeting",
    "url": "https://www.ballstonspa.gov/sites/g/files/vyhlif6186/f/events/special_mtg._10.27.25.pdf",
    "date": "2025-10-14",
    "category": "Board of Trustees",
    "type": "Minutes",
    "pageUrl": "https://www.ballstonspa.gov/home/events/19461"
  },
  {
    "id": "doc-97-_sites_g_files_vyhlif6186_f_events_agenda_11_10_25_fsr_amended_pdf",
    "title": "agenda_11.10.25_fsr_amended.pdf",
    "event": "Village of Ballston Spa Board of Trustees Meeting",
    "url": "https://www.ballstonspa.gov/sites/g/files/vyhlif6186/f/events/agenda_11.10.25_fsr_amended.pdf",
    "date": "2025-10-14",
    "category": "Board of Trustees",
    "type": "Agenda",
    "pageUrl": "https://www.ballstonspa.gov/home/events/19461"
  },
  {
    "id": "doc-98-_sites_g_files_vyhlif6186_f_events_2026_bspa_fiscal_sponsorhip_projects_pdf",
    "title": "2026_bspa_fiscal_sponsorhip_projects.pdf",
    "event": "Village of Ballston Spa Board of Trustees Meeting",
    "url": "https://www.ballstonspa.gov/sites/g/files/vyhlif6186/f/events/2026_bspa_fiscal_sponsorhip_projects.pdf",
    "date": "2025-10-14",
    "category": "Board of Trustees",
    "type": "Project Document",
    "pageUrl": "https://www.ballstonspa.gov/home/events/19461"
  },
  {
    "id": "doc-99-_sites_g_files_vyhlif6186_f_events_bd__mtg__09_22_25_pdf",
    "title": "bd._mtg._09.22.25.pdf",
    "event": "Village of Ballston Spa Board of Trustees Meeting",
    "url": "https://www.ballstonspa.gov/sites/g/files/vyhlif6186/f/events/bd._mtg._09.22.25.pdf",
    "date": "2025-10-14",
    "category": "Board of Trustees",
    "type": "Minutes",
    "pageUrl": "https://www.ballstonspa.gov/home/events/15961"
  },
  {
    "id": "doc-100-_sites_g_files_vyhlif6186_f_events_agenda_10_14_25_fsr_pdf",
    "title": "agenda_10.14.25_fsr.pdf",
    "event": "Village of Ballston Spa Board of Trustees Meeting",
    "url": "https://www.ballstonspa.gov/sites/g/files/vyhlif6186/f/events/agenda_10.14.25_fsr.pdf",
    "date": "2025-10-14",
    "category": "Board of Trustees",
    "type": "Agenda",
    "pageUrl": "https://www.ballstonspa.gov/home/events/15961"
  },
  {
    "id": "doc-101-_sites_g_files_vyhlif6186_f_events_10_14_25_att_pdf",
    "title": "10.14.25_att.pdf",
    "event": "Village of Ballston Spa Board of Trustees Meeting",
    "url": "https://www.ballstonspa.gov/sites/g/files/vyhlif6186/f/events/10.14.25_att.pdf",
    "date": "2025-10-14",
    "category": "Board of Trustees",
    "type": "Project Document",
    "pageUrl": "https://www.ballstonspa.gov/home/events/15961"
  },
  {
    "id": "doc-102-_sites_g_files_vyhlif6186_f_events_11-10-2025_att_2_of_2_pdf",
    "title": "11-10-2025_att_2_of_2.pdf",
    "event": "Village of Ballston Spa Board of Trustees Meeting",
    "url": "https://www.ballstonspa.gov/sites/g/files/vyhlif6186/f/events/11-10-2025_att_2_of_2.pdf",
    "date": "2025-10-14",
    "category": "Board of Trustees",
    "type": "Project Document",
    "pageUrl": "https://www.ballstonspa.gov/home/events/15966"
  },
  {
    "id": "doc-103-_sites_g_files_vyhlif6186_f_events_11-10-2025_att_1_of_2_pdf",
    "title": "11-10-2025_att_1_of_2.pdf",
    "event": "Village of Ballston Spa Board of Trustees Meeting",
    "url": "https://www.ballstonspa.gov/sites/g/files/vyhlif6186/f/events/11-10-2025_att_1_of_2.pdf",
    "date": "2025-10-14",
    "category": "Board of Trustees",
    "type": "Project Document",
    "pageUrl": "https://www.ballstonspa.gov/home/events/15966"
  },
  {
    "id": "doc-104-_sites_g_files_vyhlif6186_f_events_bd__mtg__10_27_25_pdf",
    "title": "bd._mtg._10.27.25.pdf",
    "event": "Village of Ballston Spa Board of Trustees Meeting",
    "url": "https://www.ballstonspa.gov/sites/g/files/vyhlif6186/f/events/bd._mtg._10.27.25.pdf",
    "date": "2025-10-14",
    "category": "Board of Trustees",
    "type": "Minutes",
    "pageUrl": "https://www.ballstonspa.gov/home/events/15966"
  },
  {
    "id": "doc-105-_sites_g_files_vyhlif6186_f_events_special_mtg__10_27_25_pdf",
    "title": "special_mtg._10.27.25.pdf",
    "event": "Village of Ballston Spa Board of Trustees Meeting",
    "url": "https://www.ballstonspa.gov/sites/g/files/vyhlif6186/f/events/special_mtg._10.27.25.pdf",
    "date": "2025-10-14",
    "category": "Board of Trustees",
    "type": "Minutes",
    "pageUrl": "https://www.ballstonspa.gov/home/events/15966"
  },
  {
    "id": "doc-106-_sites_g_files_vyhlif6186_f_events_agenda_11_10_25_fsr_pdf",
    "title": "agenda_11.10.25_fsr.pdf",
    "event": "Village of Ballston Spa Board of Trustees Meeting",
    "url": "https://www.ballstonspa.gov/sites/g/files/vyhlif6186/f/events/agenda_11.10.25_fsr.pdf",
    "date": "2025-10-14",
    "category": "Board of Trustees",
    "type": "Agenda",
    "pageUrl": "https://www.ballstonspa.gov/home/events/15966"
  },
  {
    "id": "doc-107-_sites_g_files_vyhlif6186_f_events_12_08_25_att_pdf",
    "title": "12.08.25_att.pdf",
    "event": "Village of Ballston Spa Board of Trustees Meeting",
    "url": "https://www.ballstonspa.gov/sites/g/files/vyhlif6186/f/events/12.08.25_att.pdf",
    "date": "2025-10-14",
    "category": "Board of Trustees",
    "type": "Project Document",
    "pageUrl": "https://www.ballstonspa.gov/home/events/20076"
  },
  {
    "id": "doc-108-_sites_g_files_vyhlif6186_f_events_bd__mtg__11_24_25_pdf",
    "title": "bd._mtg._11.24.25.pdf",
    "event": "Village of Ballston Spa Board of Trustees Meeting",
    "url": "https://www.ballstonspa.gov/sites/g/files/vyhlif6186/f/events/bd._mtg._11.24.25.pdf",
    "date": "2025-10-14",
    "category": "Board of Trustees",
    "type": "Minutes",
    "pageUrl": "https://www.ballstonspa.gov/home/events/20076"
  },
  {
    "id": "doc-109-_sites_g_files_vyhlif6186_f_events_agenda_12_08_25_-_fsr_pdf",
    "title": "agenda_12.08.25_-_fsr.pdf",
    "event": "Village of Ballston Spa Board of Trustees Meeting",
    "url": "https://www.ballstonspa.gov/sites/g/files/vyhlif6186/f/events/agenda_12.08.25_-_fsr.pdf",
    "date": "2025-10-14",
    "category": "Board of Trustees",
    "type": "Agenda",
    "pageUrl": "https://www.ballstonspa.gov/home/events/20076"
  },
  {
    "id": "doc-110-_sites_g_files_vyhlif6186_f_events_11-10-2025_att_2_of_2_pdf",
    "title": "11-10-2025_att_2_of_2.pdf",
    "event": "Village of Ballston Spa Board of Trustees Meeting",
    "url": "https://www.ballstonspa.gov/sites/g/files/vyhlif6186/f/events/11-10-2025_att_2_of_2.pdf",
    "date": "2025-10-14",
    "category": "Board of Trustees",
    "type": "Project Document",
    "pageUrl": "https://www.ballstonspa.gov/home/events/19341"
  },
  {
    "id": "doc-111-_sites_g_files_vyhlif6186_f_events_11-10-2025_att_1_of_2_pdf",
    "title": "11-10-2025_att_1_of_2.pdf",
    "event": "Village of Ballston Spa Board of Trustees Meeting",
    "url": "https://www.ballstonspa.gov/sites/g/files/vyhlif6186/f/events/11-10-2025_att_1_of_2.pdf",
    "date": "2025-10-14",
    "category": "Board of Trustees",
    "type": "Project Document",
    "pageUrl": "https://www.ballstonspa.gov/home/events/19341"
  },
  {
    "id": "doc-112-_sites_g_files_vyhlif6186_f_events_bd__mtg__10_27_25_pdf",
    "title": "bd._mtg._10.27.25.pdf",
    "event": "Village of Ballston Spa Board of Trustees Meeting",
    "url": "https://www.ballstonspa.gov/sites/g/files/vyhlif6186/f/events/bd._mtg._10.27.25.pdf",
    "date": "2025-10-14",
    "category": "Board of Trustees",
    "type": "Minutes",
    "pageUrl": "https://www.ballstonspa.gov/home/events/19341"
  },
  {
    "id": "doc-113-_sites_g_files_vyhlif6186_f_events_special_mtg__10_27_25_pdf",
    "title": "special_mtg._10.27.25.pdf",
    "event": "Village of Ballston Spa Board of Trustees Meeting",
    "url": "https://www.ballstonspa.gov/sites/g/files/vyhlif6186/f/events/special_mtg._10.27.25.pdf",
    "date": "2025-10-14",
    "category": "Board of Trustees",
    "type": "Minutes",
    "pageUrl": "https://www.ballstonspa.gov/home/events/19341"
  },
  {
    "id": "doc-114-_sites_g_files_vyhlif6186_f_events_agenda_11_10_25_fsr_amended_pdf",
    "title": "agenda_11.10.25_fsr_amended.pdf",
    "event": "Village of Ballston Spa Board of Trustees Meeting",
    "url": "https://www.ballstonspa.gov/sites/g/files/vyhlif6186/f/events/agenda_11.10.25_fsr_amended.pdf",
    "date": "2025-10-14",
    "category": "Board of Trustees",
    "type": "Agenda",
    "pageUrl": "https://www.ballstonspa.gov/home/events/19341"
  },
  {
    "id": "doc-115-_sites_g_files_vyhlif6186_f_events_11-10-2025_att_2_of_2_pdf",
    "title": "11-10-2025_att_2_of_2.pdf",
    "event": "Village of Ballston Spa Board of Trustees Meeting",
    "url": "https://www.ballstonspa.gov/sites/g/files/vyhlif6186/f/events/11-10-2025_att_2_of_2.pdf",
    "date": "2025-10-14",
    "category": "Board of Trustees",
    "type": "Project Document",
    "pageUrl": "https://www.ballstonspa.gov/home/events/19346"
  },
  {
    "id": "doc-116-_sites_g_files_vyhlif6186_f_events_11-10-2025_att_1_of_2_pdf",
    "title": "11-10-2025_att_1_of_2.pdf",
    "event": "Village of Ballston Spa Board of Trustees Meeting",
    "url": "https://www.ballstonspa.gov/sites/g/files/vyhlif6186/f/events/11-10-2025_att_1_of_2.pdf",
    "date": "2025-10-14",
    "category": "Board of Trustees",
    "type": "Project Document",
    "pageUrl": "https://www.ballstonspa.gov/home/events/19346"
  },
  {
    "id": "doc-117-_sites_g_files_vyhlif6186_f_events_bd__mtg__10_27_25_pdf",
    "title": "bd._mtg._10.27.25.pdf",
    "event": "Village of Ballston Spa Board of Trustees Meeting",
    "url": "https://www.ballstonspa.gov/sites/g/files/vyhlif6186/f/events/bd._mtg._10.27.25.pdf",
    "date": "2025-10-14",
    "category": "Board of Trustees",
    "type": "Minutes",
    "pageUrl": "https://www.ballstonspa.gov/home/events/19346"
  },
  {
    "id": "doc-118-_sites_g_files_vyhlif6186_f_events_special_mtg__10_27_25_pdf",
    "title": "special_mtg._10.27.25.pdf",
    "event": "Village of Ballston Spa Board of Trustees Meeting",
    "url": "https://www.ballstonspa.gov/sites/g/files/vyhlif6186/f/events/special_mtg._10.27.25.pdf",
    "date": "2025-10-14",
    "category": "Board of Trustees",
    "type": "Minutes",
    "pageUrl": "https://www.ballstonspa.gov/home/events/19346"
  },
  {
    "id": "doc-119-_sites_g_files_vyhlif6186_f_events_agenda_11_10_25_fsr_pdf",
    "title": "agenda_11.10.25_fsr.pdf",
    "event": "Village of Ballston Spa Board of Trustees Meeting",
    "url": "https://www.ballstonspa.gov/sites/g/files/vyhlif6186/f/events/agenda_11.10.25_fsr.pdf",
    "date": "2025-10-14",
    "category": "Board of Trustees",
    "type": "Agenda",
    "pageUrl": "https://www.ballstonspa.gov/home/events/19346"
  },
  {
    "id": "doc-120-_sites_g_files_vyhlif6186_f_events_11-10-2025_att_2_of_2_pdf",
    "title": "11-10-2025_att_2_of_2.pdf",
    "event": "Village of Ballston Spa Board of Trustees Meeting",
    "url": "https://www.ballstonspa.gov/sites/g/files/vyhlif6186/f/events/11-10-2025_att_2_of_2.pdf",
    "date": "2025-10-14",
    "category": "Board of Trustees",
    "type": "Project Document",
    "pageUrl": "https://www.ballstonspa.gov/home/events/19396"
  },
  {
    "id": "doc-121-_sites_g_files_vyhlif6186_f_events_11-10-2025_att_1_of_2_pdf",
    "title": "11-10-2025_att_1_of_2.pdf",
    "event": "Village of Ballston Spa Board of Trustees Meeting",
    "url": "https://www.ballstonspa.gov/sites/g/files/vyhlif6186/f/events/11-10-2025_att_1_of_2.pdf",
    "date": "2025-10-14",
    "category": "Board of Trustees",
    "type": "Project Document",
    "pageUrl": "https://www.ballstonspa.gov/home/events/19396"
  },
  {
    "id": "doc-122-_sites_g_files_vyhlif6186_f_events_bd__mtg__10_27_25_pdf",
    "title": "bd._mtg._10.27.25.pdf",
    "event": "Village of Ballston Spa Board of Trustees Meeting",
    "url": "https://www.ballstonspa.gov/sites/g/files/vyhlif6186/f/events/bd._mtg._10.27.25.pdf",
    "date": "2025-10-14",
    "category": "Board of Trustees",
    "type": "Minutes",
    "pageUrl": "https://www.ballstonspa.gov/home/events/19396"
  },
  {
    "id": "doc-123-_sites_g_files_vyhlif6186_f_events_special_mtg__10_27_25_pdf",
    "title": "special_mtg._10.27.25.pdf",
    "event": "Village of Ballston Spa Board of Trustees Meeting",
    "url": "https://www.ballstonspa.gov/sites/g/files/vyhlif6186/f/events/special_mtg._10.27.25.pdf",
    "date": "2025-10-14",
    "category": "Board of Trustees",
    "type": "Minutes",
    "pageUrl": "https://www.ballstonspa.gov/home/events/19396"
  },
  {
    "id": "doc-124-_sites_g_files_vyhlif6186_f_events_agenda_11_10_25_fsr_pdf",
    "title": "agenda_11.10.25_fsr.pdf",
    "event": "Village of Ballston Spa Board of Trustees Meeting",
    "url": "https://www.ballstonspa.gov/sites/g/files/vyhlif6186/f/events/agenda_11.10.25_fsr.pdf",
    "date": "2025-10-14",
    "category": "Board of Trustees",
    "type": "Agenda",
    "pageUrl": "https://www.ballstonspa.gov/home/events/19396"
  },
  {
    "id": "doc-125-_sites_g_files_vyhlif6186_f_events_12_08_25_att_pdf",
    "title": "12.08.25_att.pdf",
    "event": "Village of Ballston Spa Board of Trustees Meeting",
    "url": "https://www.ballstonspa.gov/sites/g/files/vyhlif6186/f/events/12.08.25_att.pdf",
    "date": "2025-10-14",
    "category": "Board of Trustees",
    "type": "Project Document",
    "pageUrl": "https://www.ballstonspa.gov/home/events/20166"
  },
  {
    "id": "doc-126-_sites_g_files_vyhlif6186_f_events_agenda_12_08_25_-_fsr_pdf",
    "title": "agenda_12.08.25_-_fsr.pdf",
    "event": "Village of Ballston Spa Board of Trustees Meeting",
    "url": "https://www.ballstonspa.gov/sites/g/files/vyhlif6186/f/events/agenda_12.08.25_-_fsr.pdf",
    "date": "2025-10-14",
    "category": "Board of Trustees",
    "type": "Agenda",
    "pageUrl": "https://www.ballstonspa.gov/home/events/20166"
  },
  {
    "id": "doc-127-_sites_g_files_vyhlif6186_f_events_bd__mtg__11_24_25_0_pdf",
    "title": "bd._mtg._11.24.25_0.pdf",
    "event": "Village of Ballston Spa Board of Trustees Meeting",
    "url": "https://www.ballstonspa.gov/sites/g/files/vyhlif6186/f/events/bd._mtg._11.24.25_0.pdf",
    "date": "2025-10-14",
    "category": "Board of Trustees",
    "type": "Minutes",
    "pageUrl": "https://www.ballstonspa.gov/home/events/20166"
  },
  {
    "id": "doc-128-_sites_g_files_vyhlif6186_f_events_10_8_25_meeting_agenda_pdf",
    "title": "10.8.25_meeting_agenda.pdf",
    "event": "Planning Board Meeting",
    "url": "https://www.ballstonspa.gov/sites/g/files/vyhlif6186/f/events/10.8.25_meeting_agenda.pdf",
    "date": "2025-10-08",
    "category": "Planning Board",
    "type": "Agenda",
    "pageUrl": "https://www.ballstonspa.gov/home/events/18891"
  },
  {
    "id": "doc-129-_sites_g_files_vyhlif6186_f_events_info_packet_154_milton_ave_mcandrew_0_pdf",
    "title": "info_packet_154_milton_ave_mcandrew_0.pdf",
    "event": "Planning Board Meeting",
    "url": "https://www.ballstonspa.gov/sites/g/files/vyhlif6186/f/events/info_packet_154_milton_ave_mcandrew_0.pdf",
    "date": "2025-10-08",
    "category": "Planning Board",
    "type": "Project Document",
    "pageUrl": "https://www.ballstonspa.gov/home/events/18891"
  },
  {
    "id": "doc-130-_sites_g_files_vyhlif6186_f_events_info_packet_20_milton_ave_pdf",
    "title": "info_packet_20_milton_ave.pdf",
    "event": "Zoning Board of Appeals Meeting",
    "url": "https://www.ballstonspa.gov/sites/g/files/vyhlif6186/f/events/info_packet_20_milton_ave.pdf",
    "date": "2025-09-24",
    "category": "Zoning Board",
    "type": "Project Document",
    "pageUrl": "https://www.ballstonspa.gov/home/events/18571"
  },
  {
    "id": "doc-131-_sites_g_files_vyhlif6186_f_events_9_24_25_zba_agenda_pdf",
    "title": "9.24.25_zba_agenda.pdf",
    "event": "Zoning Board of Appeals Meeting",
    "url": "https://www.ballstonspa.gov/sites/g/files/vyhlif6186/f/events/9.24.25_zba_agenda.pdf",
    "date": "2025-09-24",
    "category": "Zoning Board",
    "type": "Agenda",
    "pageUrl": "https://www.ballstonspa.gov/home/events/18571"
  },
  {
    "id": "doc-132-_sites_g_files_vyhlif6186_f_events_bd__mtg__09_08_25_pdf",
    "title": "bd._mtg._09.08.25.pdf",
    "event": "Village of Ballston Spa Board of Trustees Meeting",
    "url": "https://www.ballstonspa.gov/sites/g/files/vyhlif6186/f/events/bd._mtg._09.08.25.pdf",
    "date": "2025-09-22",
    "category": "Board of Trustees",
    "type": "Minutes",
    "pageUrl": "https://www.ballstonspa.gov/home/events/18736"
  },
  {
    "id": "doc-133-_sites_g_files_vyhlif6186_f_events_9-22-25_attachments_pdf",
    "title": "9-22-25_attachments.pdf",
    "event": "Village of Ballston Spa Board of Trustees Meeting",
    "url": "https://www.ballstonspa.gov/sites/g/files/vyhlif6186/f/events/9-22-25_attachments.pdf",
    "date": "2025-09-22",
    "category": "Board of Trustees",
    "type": "Project Document",
    "pageUrl": "https://www.ballstonspa.gov/home/events/18736"
  },
  {
    "id": "doc-134-_sites_g_files_vyhlif6186_f_events_agenda_09_22_25_fsr_with_abstract_numbers_pdf",
    "title": "agenda_09.22.25_fsr_with_abstract_numbers.pdf",
    "event": "Village of Ballston Spa Board of Trustees Meeting",
    "url": "https://www.ballstonspa.gov/sites/g/files/vyhlif6186/f/events/agenda_09.22.25_fsr_with_abstract_numbers.pdf",
    "date": "2025-09-22",
    "category": "Board of Trustees",
    "type": "Agenda",
    "pageUrl": "https://www.ballstonspa.gov/home/events/18736"
  },
  {
    "id": "doc-135-_sites_g_files_vyhlif6186_f_events_proposed_model_law_pdf",
    "title": "proposed_model_law.pdf",
    "event": "Historic District Commission Presentation",
    "url": "https://www.ballstonspa.gov/sites/g/files/vyhlif6186/f/events/proposed_model_law.pdf",
    "date": "2025-09-22",
    "category": "Historic District Commission",
    "type": "Project Document",
    "pageUrl": "https://www.ballstonspa.gov/home/events/18256"
  },
  {
    "id": "doc-136-_sites_g_files_vyhlif6186_f_events_9_17_2025_meeting_agenda_pdf",
    "title": "9.17.2025_meeting_agenda.pdf",
    "event": "Committee on the Arts Meeting",
    "url": "https://www.ballstonspa.gov/sites/g/files/vyhlif6186/f/events/9.17.2025_meeting_agenda.pdf",
    "date": "2025-09-17",
    "category": "Committee on the Arts",
    "type": "Agenda",
    "pageUrl": "https://www.ballstonspa.gov/home/events/17601"
  },
  {
    "id": "doc-137-_sites_g_files_vyhlif6186_f_events_park_and_tree_agenda_9_16_25_pdf",
    "title": "park_and_tree_agenda_9.16.25.pdf",
    "event": "Park and Tree Meeting",
    "url": "https://www.ballstonspa.gov/sites/g/files/vyhlif6186/f/events/park_and_tree_agenda_9.16.25.pdf",
    "date": "2025-09-16",
    "category": "Park and Tree",
    "type": "Agenda",
    "pageUrl": "https://www.ballstonspa.gov/home/events/18561"
  },
  {
    "id": "doc-138-_sites_g_files_vyhlif6186_f_events_5865a_-_site_plan_app_checklist_pdf",
    "title": "5865a_-_site_plan_app_checklist.pdf",
    "event": "Planning Board Meeting",
    "url": "https://www.ballstonspa.gov/sites/g/files/vyhlif6186/f/events/5865a_-_site_plan_app_checklist.pdf",
    "date": "2025-09-10",
    "category": "Planning Board",
    "type": "Project Document",
    "pageUrl": "https://www.ballstonspa.gov/home/events/18501"
  },
  {
    "id": "doc-139-_files_vyhlif6186_f_events_executed_purchase_agreement_-_7-8-2025_katz_rossi_pdf",
    "title": "executed_purchase_agreement_-_7-8-2025_katz_rossi.pdf",
    "event": "Planning Board Meeting",
    "url": "https://www.ballstonspa.gov/sites/g/files/vyhlif6186/f/events/executed_purchase_agreement_-_7-8-2025_katz_rossi.pdf",
    "date": "2025-09-10",
    "category": "Planning Board",
    "type": "Project Document",
    "pageUrl": "https://www.ballstonspa.gov/home/events/18501"
  },
  {
    "id": "doc-140-_sites_g_files_vyhlif6186_f_events_5865a-sub_pdf",
    "title": "5865a-sub.pdf",
    "event": "Planning Board Meeting",
    "url": "https://www.ballstonspa.gov/sites/g/files/vyhlif6186/f/events/5865a-sub.pdf",
    "date": "2025-09-10",
    "category": "Planning Board",
    "type": "Project Document",
    "pageUrl": "https://www.ballstonspa.gov/home/events/18501"
  },
  {
    "id": "doc-141-_sites_g_files_vyhlif6186_f_events_5865a_-_subdvision_app_pdf",
    "title": "5865a_-_subdvision_app.pdf",
    "event": "Planning Board Meeting",
    "url": "https://www.ballstonspa.gov/sites/g/files/vyhlif6186/f/events/5865a_-_subdvision_app.pdf",
    "date": "2025-09-10",
    "category": "Planning Board",
    "type": "Project Document",
    "pageUrl": "https://www.ballstonspa.gov/home/events/18501"
  },
  {
    "id": "doc-142-_sites_g_files_vyhlif6186_f_events_5865a_-_site_plan_pdf",
    "title": "5865a_-_site_plan.pdf",
    "event": "Planning Board Meeting",
    "url": "https://www.ballstonspa.gov/sites/g/files/vyhlif6186/f/events/5865a_-_site_plan.pdf",
    "date": "2025-09-10",
    "category": "Planning Board",
    "type": "Project Document",
    "pageUrl": "https://www.ballstonspa.gov/home/events/18501"
  },
  {
    "id": "doc-143-_sites_g_files_vyhlif6186_f_events_5865a_-_seaf_pdf",
    "title": "5865a_-_seaf.pdf",
    "event": "Planning Board Meeting",
    "url": "https://www.ballstonspa.gov/sites/g/files/vyhlif6186/f/events/5865a_-_seaf.pdf",
    "date": "2025-09-10",
    "category": "Planning Board",
    "type": "Project Document",
    "pageUrl": "https://www.ballstonspa.gov/home/events/18501"
  },
  {
    "id": "doc-144-_sites_g_files_vyhlif6186_f_events_5865a_-_cover_letter_pdf",
    "title": "5865a_-_cover_letter.pdf",
    "event": "Planning Board Meeting",
    "url": "https://www.ballstonspa.gov/sites/g/files/vyhlif6186/f/events/5865a_-_cover_letter.pdf",
    "date": "2025-09-10",
    "category": "Planning Board",
    "type": "Project Document",
    "pageUrl": "https://www.ballstonspa.gov/home/events/18501"
  },
  {
    "id": "doc-145-_sites_g_files_vyhlif6186_f_events_2025_-_0602_-_5865a_-project_narrative_pdf",
    "title": "2025_-_0602_-_5865a_-project_narrative.pdf",
    "event": "Planning Board Meeting",
    "url": "https://www.ballstonspa.gov/sites/g/files/vyhlif6186/f/events/2025_-_0602_-_5865a_-project_narrative.pdf",
    "date": "2025-09-10",
    "category": "Planning Board",
    "type": "Project Document",
    "pageUrl": "https://www.ballstonspa.gov/home/events/18501"
  },
  {
    "id": "doc-146-_sites_g_files_vyhlif6186_f_events_9_10_25_meeting_agenda_pdf",
    "title": "9.10.25_meeting_agenda.pdf",
    "event": "Planning Board Meeting",
    "url": "https://www.ballstonspa.gov/sites/g/files/vyhlif6186/f/events/9.10.25_meeting_agenda.pdf",
    "date": "2025-09-10",
    "category": "Planning Board",
    "type": "Agenda",
    "pageUrl": "https://www.ballstonspa.gov/home/events/18501"
  },
  {
    "id": "doc-147-_files_vyhlif6186_f_events_planning_board_9_10_25_meeting_ltr_to_katz_9_3_25_pdf",
    "title": "planning_board_9.10.25_meeting_ltr_to_katz_9.3.25.pdf",
    "event": "Planning Board Meeting",
    "url": "https://www.ballstonspa.gov/sites/g/files/vyhlif6186/f/events/planning_board_9.10.25_meeting_ltr_to_katz_9.3.25.pdf",
    "date": "2025-09-10",
    "category": "Planning Board",
    "type": "Project Document",
    "pageUrl": "https://www.ballstonspa.gov/home/events/18501"
  },
  {
    "id": "doc-148-_sites_g_files_vyhlif6186_f_events_bd__mtg__08_25_25_pdf",
    "title": "bd._mtg._08.25.25.pdf",
    "event": "Village of Ballston Spa Board of Trustees Meeting",
    "url": "https://www.ballstonspa.gov/sites/g/files/vyhlif6186/f/events/bd._mtg._08.25.25.pdf",
    "date": "2025-09-08",
    "category": "Board of Trustees",
    "type": "Minutes",
    "pageUrl": "https://www.ballstonspa.gov/home/events/15956"
  },
  {
    "id": "doc-149-_sites_g_files_vyhlif6186_f_events_agenda_09_08_25_fsr_pdf",
    "title": "agenda_09.08.25_fsr.pdf",
    "event": "Village of Ballston Spa Board of Trustees Meeting",
    "url": "https://www.ballstonspa.gov/sites/g/files/vyhlif6186/f/events/agenda_09.08.25_fsr.pdf",
    "date": "2025-09-08",
    "category": "Board of Trustees",
    "type": "Agenda",
    "pageUrl": "https://www.ballstonspa.gov/home/events/15956"
  },
  {
    "id": "doc-150-_sites_g_files_vyhlif6186_f_events_09_08_25_att_0_pdf",
    "title": "09.08.25_att_0.pdf",
    "event": "Village of Ballston Spa Board of Trustees Meeting",
    "url": "https://www.ballstonspa.gov/sites/g/files/vyhlif6186/f/events/09.08.25_att_0.pdf",
    "date": "2025-09-08",
    "category": "Board of Trustees",
    "type": "Project Document",
    "pageUrl": "https://www.ballstonspa.gov/home/events/15956"
  },
  {
    "id": "doc-151-_sites_g_files_vyhlif6186_f_events_zoning_code_8_26_25_easier_to_read_pdf",
    "title": "zoning_code_8.26.25_easier_to_read.pdf",
    "event": "Village of Ballston Spa Special Trustees Meeting",
    "url": "https://www.ballstonspa.gov/sites/g/files/vyhlif6186/f/events/zoning_code_8.26.25_easier_to_read.pdf",
    "date": "2025-08-27",
    "category": "Board of Trustees",
    "type": "Project Document",
    "pageUrl": "https://www.ballstonspa.gov/home/events/18336"
  },
  {
    "id": "doc-152-_sites_g_files_vyhlif6186_f_events_8_27_25_zba_agenda_pdf",
    "title": "8.27.25_zba_agenda.pdf",
    "event": "Location Change : Zoning Board of Appeals Meeting",
    "url": "https://www.ballstonspa.gov/sites/g/files/vyhlif6186/f/events/8.27.25_zba_agenda.pdf",
    "date": "2025-08-27",
    "category": "Zoning Board",
    "type": "Agenda",
    "pageUrl": "https://www.ballstonspa.gov/home/events/18296"
  },
  {
    "id": "doc-153-_sites_g_files_vyhlif6186_f_events_7_30_25_zba_minutes_-_draft_pdf",
    "title": "7.30.25_zba_minutes_-_draft.pdf",
    "event": "Location Change : Zoning Board of Appeals Meeting",
    "url": "https://www.ballstonspa.gov/sites/g/files/vyhlif6186/f/events/7.30.25_zba_minutes_-_draft.pdf",
    "date": "2025-08-27",
    "category": "Zoning Board",
    "type": "Minutes",
    "pageUrl": "https://www.ballstonspa.gov/home/events/18296"
  },
  {
    "id": "doc-154-_vyhlif6186_f_events_info_packet_washington_st_216_32-1-96_1_row_houses_tacy_pdf",
    "title": "info_packet_washington_st_216.32-1-96.1_row_houses_tacy.pdf",
    "event": "Location Change : Zoning Board of Appeals Meeting",
    "url": "https://www.ballstonspa.gov/sites/g/files/vyhlif6186/f/events/info_packet_washington_st_216.32-1-96.1_row_houses_tacy.pdf",
    "date": "2025-08-27",
    "category": "Zoning Board",
    "type": "Project Document",
    "pageUrl": "https://www.ballstonspa.gov/home/events/18296"
  },
  {
    "id": "doc-155-f6186_f_events_info_packet_washington_st_216_32-2-2_single_family_homes_tacy_pdf",
    "title": "info_packet_washington_st_216.32-2-2_single_family_homes_tacy.pdf",
    "event": "Location Change : Zoning Board of Appeals Meeting",
    "url": "https://www.ballstonspa.gov/sites/g/files/vyhlif6186/f/events/info_packet_washington_st_216.32-2-2_single_family_homes_tacy.pdf",
    "date": "2025-08-27",
    "category": "Zoning Board",
    "type": "Project Document",
    "pageUrl": "https://www.ballstonspa.gov/home/events/18296"
  },
  {
    "id": "doc-156-_sites_g_files_vyhlif6186_f_events_info_packet_galway_st_storage_units_tacy_pdf",
    "title": "info_packet_galway_st_storage_units_tacy.pdf",
    "event": "Location Change : Zoning Board of Appeals Meeting",
    "url": "https://www.ballstonspa.gov/sites/g/files/vyhlif6186/f/events/info_packet_galway_st_storage_units_tacy.pdf",
    "date": "2025-08-27",
    "category": "Zoning Board",
    "type": "Project Document",
    "pageUrl": "https://www.ballstonspa.gov/home/events/18296"
  },
  {
    "id": "doc-157-_sites_g_files_vyhlif6186_f_events_bd__mtg__08_11_25_pdf",
    "title": "bd._mtg._08.11.25.pdf",
    "event": "Village of Ballston Spa Board of Trustees Meeting",
    "url": "https://www.ballstonspa.gov/sites/g/files/vyhlif6186/f/events/bd._mtg._08.11.25.pdf",
    "date": "2025-08-25",
    "category": "Board of Trustees",
    "type": "Minutes",
    "pageUrl": "https://www.ballstonspa.gov/home/events/18411"
  },
  {
    "id": "doc-158-_sites_g_files_vyhlif6186_f_events_agenda_08_25_25_fsr_pdf",
    "title": "agenda_08.25.25_fsr.pdf",
    "event": "Village of Ballston Spa Board of Trustees Meeting",
    "url": "https://www.ballstonspa.gov/sites/g/files/vyhlif6186/f/events/agenda_08.25.25_fsr.pdf",
    "date": "2025-08-25",
    "category": "Board of Trustees",
    "type": "Agenda",
    "pageUrl": "https://www.ballstonspa.gov/home/events/18411"
  },
  {
    "id": "doc-159-_sites_g_files_vyhlif6186_f_events_08_25_25_att_with_resolution_pdf",
    "title": "08.25.25_att_with_resolution.pdf",
    "event": "Village of Ballston Spa Board of Trustees Meeting",
    "url": "https://www.ballstonspa.gov/sites/g/files/vyhlif6186/f/events/08.25.25_att_with_resolution.pdf",
    "date": "2025-08-25",
    "category": "Board of Trustees",
    "type": "Project Document",
    "pageUrl": "https://www.ballstonspa.gov/home/events/18411"
  },
  {
    "id": "doc-160-s_g_files_vyhlif6186_f_events_historic_district_commision_aug_21_2025_agenda_pdf",
    "title": "historic_district_commision_aug_21_2025_agenda.pdf",
    "event": "Historic District Commission Meeting",
    "url": "https://www.ballstonspa.gov/sites/g/files/vyhlif6186/f/events/historic_district_commision_aug_21_2025_agenda.pdf",
    "date": "2025-08-21",
    "category": "Historic District Commission",
    "type": "Agenda",
    "pageUrl": "https://www.ballstonspa.gov/home/events/18261"
  },
  {
    "id": "doc-161-_sites_g_files_vyhlif6186_f_events_park_and_tree_agenda_8_19_25_pdf",
    "title": "park_and_tree_agenda_8.19.25.pdf",
    "event": "Park and Tree Meeting",
    "url": "https://www.ballstonspa.gov/sites/g/files/vyhlif6186/f/events/park_and_tree_agenda_8.19.25.pdf",
    "date": "2025-08-19",
    "category": "Park and Tree",
    "type": "Agenda",
    "pageUrl": "https://www.ballstonspa.gov/home/events/18321"
  },
  {
    "id": "doc-162-_sites_g_files_vyhlif6186_f_events_bd__mtg__min__07_28_25_pdf",
    "title": "bd._mtg._min._07.28.25.pdf",
    "event": "Village of Ballston Spa Board of Trustees Meeting",
    "url": "https://www.ballstonspa.gov/sites/g/files/vyhlif6186/f/events/bd._mtg._min._07.28.25.pdf",
    "date": "2025-08-11",
    "category": "Board of Trustees",
    "type": "Minutes",
    "pageUrl": "https://www.ballstonspa.gov/home/events/15951"
  },
  {
    "id": "doc-163-_sites_g_files_vyhlif6186_f_events_agenda_08_11_25_fsr_pdf",
    "title": "agenda_08.11.25_fsr.pdf",
    "event": "Village of Ballston Spa Board of Trustees Meeting",
    "url": "https://www.ballstonspa.gov/sites/g/files/vyhlif6186/f/events/agenda_08.11.25_fsr.pdf",
    "date": "2025-08-11",
    "category": "Board of Trustees",
    "type": "Agenda",
    "pageUrl": "https://www.ballstonspa.gov/home/events/15951"
  },
  {
    "id": "doc-164-_sites_g_files_vyhlif6186_f_events_special_mtg-zoning_workshop_07_21_25_pdf",
    "title": "special_mtg-zoning_workshop_07.21.25.pdf",
    "event": "Village of Ballston Spa Board of Trustees Meeting",
    "url": "https://www.ballstonspa.gov/sites/g/files/vyhlif6186/f/events/special_mtg-zoning_workshop_07.21.25.pdf",
    "date": "2025-08-11",
    "category": "Board of Trustees",
    "type": "Minutes",
    "pageUrl": "https://www.ballstonspa.gov/home/events/15951"
  },
  {
    "id": "doc-165-_sites_g_files_vyhlif6186_f_events_08_11_25_att_pdf",
    "title": "08.11.25_att.pdf",
    "event": "Village of Ballston Spa Board of Trustees Meeting",
    "url": "https://www.ballstonspa.gov/sites/g/files/vyhlif6186/f/events/08.11.25_att.pdf",
    "date": "2025-08-11",
    "category": "Board of Trustees",
    "type": "Project Document",
    "pageUrl": "https://www.ballstonspa.gov/home/events/15951"
  },
  {
    "id": "doc-166-_sites_g_files_vyhlif6186_f_events_att_7-28-2025_pdf",
    "title": "att_7-28-2025.pdf",
    "event": "Village of Ballston Spa Board of Trustees Meeting",
    "url": "https://www.ballstonspa.gov/sites/g/files/vyhlif6186/f/events/att_7-28-2025.pdf",
    "date": "2025-07-28",
    "category": "Board of Trustees",
    "type": "Project Document",
    "pageUrl": "https://www.ballstonspa.gov/home/events/18181"
  },
  {
    "id": "doc-167-_sites_g_files_vyhlif6186_f_events_agenda_07_28_25_fsr_pdf",
    "title": "agenda_07.28.25_fsr.pdf",
    "event": "Village of Ballston Spa Board of Trustees Meeting",
    "url": "https://www.ballstonspa.gov/sites/g/files/vyhlif6186/f/events/agenda_07.28.25_fsr.pdf",
    "date": "2025-07-28",
    "category": "Board of Trustees",
    "type": "Agenda",
    "pageUrl": "https://www.ballstonspa.gov/home/events/18181"
  },
  {
    "id": "doc-168-_sites_g_files_vyhlif6186_f_events_bd__mtg__07_16_25_pdf",
    "title": "bd._mtg._07.16.25.pdf",
    "event": "Village of Ballston Spa Board of Trustees Meeting",
    "url": "https://www.ballstonspa.gov/sites/g/files/vyhlif6186/f/events/bd._mtg._07.16.25.pdf",
    "date": "2025-07-28",
    "category": "Board of Trustees",
    "type": "Minutes",
    "pageUrl": "https://www.ballstonspa.gov/home/events/18181"
  },
  {
    "id": "doc-169-_sites_g_files_vyhlif6186_f_events_special_agenda_07_21_25_fsr_pdf",
    "title": "special_agenda_07.21.25_fsr.pdf",
    "event": "Special Board of Trustees Meeting",
    "url": "https://www.ballstonspa.gov/sites/g/files/vyhlif6186/f/events/special_agenda_07.21.25_fsr.pdf",
    "date": "2025-07-21",
    "category": "Board of Trustees",
    "type": "Agenda",
    "pageUrl": "https://www.ballstonspa.gov/home/events/18091"
  },
  {
    "id": "doc-170-_sites_g_files_vyhlif6186_f_events_bd__mtg__06_23_25_pdf",
    "title": "bd._mtg._06.23.25.pdf",
    "event": "POSTPONED - Village of Ballston Spa Board of Trustees Meeting",
    "url": "https://www.ballstonspa.gov/sites/g/files/vyhlif6186/f/events/bd._mtg._06.23.25.pdf",
    "date": "2025-07-16",
    "category": "Board of Trustees",
    "type": "Minutes",
    "pageUrl": "https://www.ballstonspa.gov/home/events/15946"
  },
  {
    "id": "doc-171-_sites_g_files_vyhlif6186_f_events_agenda_07_16_25_fsr_0_pdf",
    "title": "agenda_07.16.25_fsr_0.pdf",
    "event": "POSTPONED - Village of Ballston Spa Board of Trustees Meeting",
    "url": "https://www.ballstonspa.gov/sites/g/files/vyhlif6186/f/events/agenda_07.16.25_fsr_0.pdf",
    "date": "2025-07-16",
    "category": "Board of Trustees",
    "type": "Agenda",
    "pageUrl": "https://www.ballstonspa.gov/home/events/15946"
  },
  {
    "id": "doc-172-_sites_g_files_vyhlif6186_f_events_07_16_25_att_0_pdf",
    "title": "07.16.25_att_0.pdf",
    "event": "POSTPONED - Village of Ballston Spa Board of Trustees Meeting",
    "url": "https://www.ballstonspa.gov/sites/g/files/vyhlif6186/f/events/07.16.25_att_0.pdf",
    "date": "2025-07-16",
    "category": "Board of Trustees",
    "type": "Project Document",
    "pageUrl": "https://www.ballstonspa.gov/home/events/15946"
  },
  {
    "id": "doc-173-_sites_g_files_vyhlif6186_f_events_hdc_7_10_25_meeting_agenda__pdf",
    "title": "hdc_7.10.25_meeting_agenda_.pdf",
    "event": "Historic District Commission Meeting",
    "url": "https://www.ballstonspa.gov/sites/g/files/vyhlif6186/f/events/hdc_7.10.25_meeting_agenda_.pdf",
    "date": "2025-07-10",
    "category": "Historic District Commission",
    "type": "Agenda",
    "pageUrl": "https://www.ballstonspa.gov/home/events/17966"
  },
  {
    "id": "doc-174-_sites_g_files_vyhlif6186_f_events_boyea_carriage_5-17-25_final-a4_pdf",
    "title": "boyea_carriage_5-17-25_final-a4.pdf",
    "event": "Planning Board Meeting",
    "url": "https://www.ballstonspa.gov/sites/g/files/vyhlif6186/f/events/boyea_carriage_5-17-25_final-a4.pdf",
    "date": "2025-07-09",
    "category": "Planning Board",
    "type": "Project Document",
    "pageUrl": "https://www.ballstonspa.gov/home/events/17941"
  },
  {
    "id": "doc-175-_sites_g_files_vyhlif6186_f_events_boyea_carriage_5-17-25_final-a3_pdf",
    "title": "boyea_carriage_5-17-25_final-a3.pdf",
    "event": "Planning Board Meeting",
    "url": "https://www.ballstonspa.gov/sites/g/files/vyhlif6186/f/events/boyea_carriage_5-17-25_final-a3.pdf",
    "date": "2025-07-09",
    "category": "Planning Board",
    "type": "Project Document",
    "pageUrl": "https://www.ballstonspa.gov/home/events/17941"
  },
  {
    "id": "doc-176-_sites_g_files_vyhlif6186_f_events_boyea_carriage_5-17-25_final-a2_pdf",
    "title": "boyea_carriage_5-17-25_final-a2.pdf",
    "event": "Planning Board Meeting",
    "url": "https://www.ballstonspa.gov/sites/g/files/vyhlif6186/f/events/boyea_carriage_5-17-25_final-a2.pdf",
    "date": "2025-07-09",
    "category": "Planning Board",
    "type": "Project Document",
    "pageUrl": "https://www.ballstonspa.gov/home/events/17941"
  },
  {
    "id": "doc-177-_sites_g_files_vyhlif6186_f_events_boyea_carriage_5-17-25_final-a1_pdf",
    "title": "boyea_carriage_5-17-25_final-a1.pdf",
    "event": "Planning Board Meeting",
    "url": "https://www.ballstonspa.gov/sites/g/files/vyhlif6186/f/events/boyea_carriage_5-17-25_final-a1.pdf",
    "date": "2025-07-09",
    "category": "Planning Board",
    "type": "Project Document",
    "pageUrl": "https://www.ballstonspa.gov/home/events/17941"
  },
  {
    "id": "doc-178-_sites_g_files_vyhlif6186_f_events_7_9_25_meeting_agenda_pdf",
    "title": "7.9.25_meeting_agenda.pdf",
    "event": "Planning Board Meeting",
    "url": "https://www.ballstonspa.gov/sites/g/files/vyhlif6186/f/events/7.9.25_meeting_agenda.pdf",
    "date": "2025-07-09",
    "category": "Planning Board",
    "type": "Agenda",
    "pageUrl": "https://www.ballstonspa.gov/home/events/17941"
  },
  {
    "id": "doc-179-_sites_g_files_vyhlif6186_f_events_bd__mtg__06_09_25_pdf",
    "title": "bd._mtg._06.09.25.pdf",
    "event": "Village of Ballston Spa Board of Trustees Meeting",
    "url": "https://www.ballstonspa.gov/sites/g/files/vyhlif6186/f/events/bd._mtg._06.09.25.pdf",
    "date": "2025-06-23",
    "category": "Board of Trustees",
    "type": "Minutes",
    "pageUrl": "https://www.ballstonspa.gov/home/events/17861"
  },
  {
    "id": "doc-180-_sites_g_files_vyhlif6186_f_events_agenda_06_23_25_fsr_0_pdf",
    "title": "agenda_06.23.25_fsr_0.pdf",
    "event": "Village of Ballston Spa Board of Trustees Meeting",
    "url": "https://www.ballstonspa.gov/sites/g/files/vyhlif6186/f/events/agenda_06.23.25_fsr_0.pdf",
    "date": "2025-06-23",
    "category": "Board of Trustees",
    "type": "Agenda",
    "pageUrl": "https://www.ballstonspa.gov/home/events/17861"
  },
  {
    "id": "doc-181-_sites_g_files_vyhlif6186_f_events_06_23_25_att_0_pdf",
    "title": "06.23.25_att_0.pdf",
    "event": "Village of Ballston Spa Board of Trustees Meeting",
    "url": "https://www.ballstonspa.gov/sites/g/files/vyhlif6186/f/events/06.23.25_att_0.pdf",
    "date": "2025-06-23",
    "category": "Board of Trustees",
    "type": "Project Document",
    "pageUrl": "https://www.ballstonspa.gov/home/events/17861"
  },
  {
    "id": "doc-182-_sites_g_files_vyhlif6186_f_events_coa_06_18_2025_agenda_pdf",
    "title": "coa_06.18.2025_agenda.pdf",
    "event": "Committee on the Arts Meeting",
    "url": "https://www.ballstonspa.gov/sites/g/files/vyhlif6186/f/events/coa_06.18.2025_agenda.pdf",
    "date": "2025-06-18",
    "category": "Committee on the Arts",
    "type": "Agenda",
    "pageUrl": "https://www.ballstonspa.gov/home/events/17446"
  },
  {
    "id": "doc-183-_sites_g_files_vyhlif6186_f_events_bspl_staff_agenda_june_12_pdf",
    "title": "bspl_staff_agenda_june_12.pdf",
    "event": "Library Board of Trustees Meeting",
    "url": "https://www.ballstonspa.gov/sites/g/files/vyhlif6186/f/events/bspl_staff_agenda_june_12.pdf",
    "date": "2025-06-17",
    "category": "Library Board",
    "type": "Agenda",
    "pageUrl": "https://www.ballstonspa.gov/home/events/17676"
  },
  {
    "id": "doc-184-_sites_g_files_vyhlif6186_f_events_park_and_tree_agenda_6_17_25_pdf",
    "title": "park_and_tree_agenda_6.17.25.pdf",
    "event": "Village of Ballston Spa Park and Tree Board",
    "url": "https://www.ballstonspa.gov/sites/g/files/vyhlif6186/f/events/park_and_tree_agenda_6.17.25.pdf",
    "date": "2025-06-17",
    "category": "Park and Tree",
    "type": "Agenda",
    "pageUrl": "https://www.ballstonspa.gov/home/events/16706"
  },
  {
    "id": "doc-185-_sites_g_files_vyhlif6186_f_events_agenda_-_committee_meeting_4_pdf",
    "title": "agenda_-_committee_meeting_4.pdf",
    "event": "BOA Committee Meeting",
    "url": "https://www.ballstonspa.gov/sites/g/files/vyhlif6186/f/events/agenda_-_committee_meeting_4.pdf",
    "date": "2025-06-12",
    "category": "BOA Steering Committee",
    "type": "Agenda",
    "pageUrl": "https://www.ballstonspa.gov/home/events/17631"
  },
  {
    "id": "doc-186-_sites_g_files_vyhlif6186_f_events_owner_authorization_pdf",
    "title": "owner_authorization.pdf",
    "event": "Joint Zoning Board and Planning Board Meeting",
    "url": "https://www.ballstonspa.gov/sites/g/files/vyhlif6186/f/events/owner_authorization.pdf",
    "date": "2025-06-11",
    "category": "Planning Board",
    "type": "Project Document",
    "pageUrl": "https://www.ballstonspa.gov/home/events/17341"
  },
  {
    "id": "doc-187-_sites_g_files_vyhlif6186_f_events_letter_of_inent_to_zba_pb_5_1_25_9850068_pdf",
    "title": "letter_of_inent_to_zba_pb_5.1.25_9850068.pdf",
    "event": "Joint Zoning Board and Planning Board Meeting",
    "url": "https://www.ballstonspa.gov/sites/g/files/vyhlif6186/f/events/letter_of_inent_to_zba_pb_5.1.25_9850068.pdf",
    "date": "2025-06-11",
    "category": "Planning Board",
    "type": "Project Document",
    "pageUrl": "https://www.ballstonspa.gov/home/events/17341"
  },
  {
    "id": "doc-188-_sites_g_files_vyhlif6186_f_events_feaf_2025-05-01_pdf",
    "title": "feaf_2025-05-01.pdf",
    "event": "Joint Zoning Board and Planning Board Meeting",
    "url": "https://www.ballstonspa.gov/sites/g/files/vyhlif6186/f/events/feaf_2025-05-01.pdf",
    "date": "2025-06-11",
    "category": "Planning Board",
    "type": "Project Document",
    "pageUrl": "https://www.ballstonspa.gov/home/events/17341"
  },
  {
    "id": "doc-189-_sites_g_files_vyhlif6186_f_events_environmental_easement_pdf",
    "title": "environmental_easement.pdf",
    "event": "Joint Zoning Board and Planning Board Meeting",
    "url": "https://www.ballstonspa.gov/sites/g/files/vyhlif6186/f/events/environmental_easement.pdf",
    "date": "2025-06-11",
    "category": "Planning Board",
    "type": "Project Document",
    "pageUrl": "https://www.ballstonspa.gov/home/events/17341"
  },
  {
    "id": "doc-190-_sites_g_files_vyhlif6186_f_events_coc_pdf",
    "title": "coc.pdf",
    "event": "Joint Zoning Board and Planning Board Meeting",
    "url": "https://www.ballstonspa.gov/sites/g/files/vyhlif6186/f/events/coc.pdf",
    "date": "2025-06-11",
    "category": "Planning Board",
    "type": "Project Document",
    "pageUrl": "https://www.ballstonspa.gov/home/events/17341"
  },
  {
    "id": "doc-191-_sites_g_files_vyhlif6186_f_events_bath_street_view_pdf",
    "title": "bath_street_view.pdf",
    "event": "Joint Zoning Board and Planning Board Meeting",
    "url": "https://www.ballstonspa.gov/sites/g/files/vyhlif6186/f/events/bath_street_view.pdf",
    "date": "2025-06-11",
    "category": "Planning Board",
    "type": "Project Document",
    "pageUrl": "https://www.ballstonspa.gov/home/events/17341"
  },
  {
    "id": "doc-192-_sites_g_files_vyhlif6186_f_events_architectural-plans-v2_pdf",
    "title": "architectural-plans-v2.pdf",
    "event": "Joint Zoning Board and Planning Board Meeting",
    "url": "https://www.ballstonspa.gov/sites/g/files/vyhlif6186/f/events/architectural-plans-v2.pdf",
    "date": "2025-06-11",
    "category": "Planning Board",
    "type": "Project Document",
    "pageUrl": "https://www.ballstonspa.gov/home/events/17341"
  },
  {
    "id": "doc-193-tes_g_files_vyhlif6186_f_events_2023024-_engineering_report-_tannery_commons_pdf",
    "title": "2023024-_engineering_report-_tannery_commons.pdf",
    "event": "Joint Zoning Board and Planning Board Meeting",
    "url": "https://www.ballstonspa.gov/sites/g/files/vyhlif6186/f/events/2023024-_engineering_report-_tannery_commons.pdf",
    "date": "2025-06-11",
    "category": "Planning Board",
    "type": "Project Document",
    "pageUrl": "https://www.ballstonspa.gov/home/events/17341"
  },
  {
    "id": "doc-194-_sites_g_files_vyhlif6186_f_events_2023024_swppp_pdf",
    "title": "2023024_swppp.pdf",
    "event": "Joint Zoning Board and Planning Board Meeting",
    "url": "https://www.ballstonspa.gov/sites/g/files/vyhlif6186/f/events/2023024_swppp.pdf",
    "date": "2025-06-11",
    "category": "Planning Board",
    "type": "Project Document",
    "pageUrl": "https://www.ballstonspa.gov/home/events/17341"
  },
  {
    "id": "doc-195-_sites_g_files_vyhlif6186_f_events_2025_5_2_ballston_spa_tannery_plan_set_pdf",
    "title": "2025.5.2_ballston_spa_tannery_plan_set.pdf",
    "event": "Joint Zoning Board and Planning Board Meeting",
    "url": "https://www.ballstonspa.gov/sites/g/files/vyhlif6186/f/events/2025.5.2_ballston_spa_tannery_plan_set.pdf",
    "date": "2025-06-11",
    "category": "Planning Board",
    "type": "Project Document",
    "pageUrl": "https://www.ballstonspa.gov/home/events/17341"
  },
  {
    "id": "doc-196-s_g_files_vyhlif6186_f_events_2025-05-02-site_plan_application_-_transmittal_pdf",
    "title": "2025-05-02-site_plan_application_-_transmittal.pdf",
    "event": "Joint Zoning Board and Planning Board Meeting",
    "url": "https://www.ballstonspa.gov/sites/g/files/vyhlif6186/f/events/2025-05-02-site_plan_application_-_transmittal.pdf",
    "date": "2025-06-11",
    "category": "Planning Board",
    "type": "Project Document",
    "pageUrl": "https://www.ballstonspa.gov/home/events/17341"
  },
  {
    "id": "doc-197-_sites_g_files_vyhlif6186_f_events_2025-05-02_sp-appv2-signed_pdf",
    "title": "2025-05-02_sp-appv2-signed.pdf",
    "event": "Joint Zoning Board and Planning Board Meeting",
    "url": "https://www.ballstonspa.gov/sites/g/files/vyhlif6186/f/events/2025-05-02_sp-appv2-signed.pdf",
    "date": "2025-06-11",
    "category": "Planning Board",
    "type": "Project Document",
    "pageUrl": "https://www.ballstonspa.gov/home/events/17341"
  },
  {
    "id": "doc-198-s_vyhlif6186_f_events_2025-04-11t14-12-08_24pr10894_effect_finding_no_impact_pdf",
    "title": "2025-04-11t14-12-08_24pr10894_effect_finding_no_impact.pdf",
    "event": "Joint Zoning Board and Planning Board Meeting",
    "url": "https://www.ballstonspa.gov/sites/g/files/vyhlif6186/f/events/2025-04-11t14-12-08_24pr10894_effect_finding_no_impact.pdf",
    "date": "2025-06-11",
    "category": "Planning Board",
    "type": "Project Document",
    "pageUrl": "https://www.ballstonspa.gov/home/events/17341"
  },
  {
    "id": "doc-199-_sites_g_files_vyhlif6186_f_events_170_traffic_study_2025-1-27_pdf",
    "title": "170_traffic_study_2025-1-27.pdf",
    "event": "Joint Zoning Board and Planning Board Meeting",
    "url": "https://www.ballstonspa.gov/sites/g/files/vyhlif6186/f/events/170_traffic_study_2025-1-27.pdf",
    "date": "2025-06-11",
    "category": "Planning Board",
    "type": "Project Document",
    "pageUrl": "https://www.ballstonspa.gov/home/events/17341"
  },
  {
    "id": "doc-200-_sites_g_files_vyhlif6186_f_events_170_habitat_assessment_report_pdf",
    "title": "170_habitat_assessment_report.pdf",
    "event": "Joint Zoning Board and Planning Board Meeting",
    "url": "https://www.ballstonspa.gov/sites/g/files/vyhlif6186/f/events/170_habitat_assessment_report.pdf",
    "date": "2025-06-11",
    "category": "Planning Board",
    "type": "Project Document",
    "pageUrl": "https://www.ballstonspa.gov/home/events/17341"
  },
  {
    "id": "doc-201-_sites_g_files_vyhlif6186_f_events_170_env_summary_ltr_1_16_2025_pdf",
    "title": "170_env_summary_ltr_1.16.2025.pdf",
    "event": "Joint Zoning Board and Planning Board Meeting",
    "url": "https://www.ballstonspa.gov/sites/g/files/vyhlif6186/f/events/170_env_summary_ltr_1.16.2025.pdf",
    "date": "2025-06-11",
    "category": "Planning Board",
    "type": "Project Document",
    "pageUrl": "https://www.ballstonspa.gov/home/events/17341"
  },
  {
    "id": "doc-202-_sites_g_files_vyhlif6186_f_events_170_eaf_support_letter_2025_3_5_pdf",
    "title": "170_eaf_support_letter_2025.3.5.pdf",
    "event": "Joint Zoning Board and Planning Board Meeting",
    "url": "https://www.ballstonspa.gov/sites/g/files/vyhlif6186/f/events/170_eaf_support_letter_2025.3.5.pdf",
    "date": "2025-06-11",
    "category": "Planning Board",
    "type": "Project Document",
    "pageUrl": "https://www.ballstonspa.gov/home/events/17341"
  },
  {
    "id": "doc-203-_sites_g_files_vyhlif6186_f_events_zba_application_-_signed_0_pdf",
    "title": "zba_application_-_signed_0.pdf",
    "event": "Joint Zoning Board and Planning Board Meeting",
    "url": "https://www.ballstonspa.gov/sites/g/files/vyhlif6186/f/events/zba_application_-_signed_0.pdf",
    "date": "2025-06-11",
    "category": "Planning Board",
    "type": "Project Document",
    "pageUrl": "https://www.ballstonspa.gov/home/events/17341"
  },
  {
    "id": "doc-204-_sites_g_files_vyhlif6186_f_events_owner_authorization_1_pdf",
    "title": "owner_authorization_1.pdf",
    "event": "Joint Zoning Board and Planning Board Meeting",
    "url": "https://www.ballstonspa.gov/sites/g/files/vyhlif6186/f/events/owner_authorization_1.pdf",
    "date": "2025-06-11",
    "category": "Planning Board",
    "type": "Project Document",
    "pageUrl": "https://www.ballstonspa.gov/home/events/17341"
  },
  {
    "id": "doc-205-sites_g_files_vyhlif6186_f_events_letter_of_inent_to_zba_pb_5_1_25_9850068_1_pdf",
    "title": "letter_of_inent_to_zba_pb_5.1.25_9850068_1.pdf",
    "event": "Joint Zoning Board and Planning Board Meeting",
    "url": "https://www.ballstonspa.gov/sites/g/files/vyhlif6186/f/events/letter_of_inent_to_zba_pb_5.1.25_9850068_1.pdf",
    "date": "2025-06-11",
    "category": "Planning Board",
    "type": "Project Document",
    "pageUrl": "https://www.ballstonspa.gov/home/events/17341"
  },
  {
    "id": "doc-206-_sites_g_files_vyhlif6186_f_events_feaf_2025-05-01_1_pdf",
    "title": "feaf_2025-05-01_1.pdf",
    "event": "Joint Zoning Board and Planning Board Meeting",
    "url": "https://www.ballstonspa.gov/sites/g/files/vyhlif6186/f/events/feaf_2025-05-01_1.pdf",
    "date": "2025-06-11",
    "category": "Planning Board",
    "type": "Project Document",
    "pageUrl": "https://www.ballstonspa.gov/home/events/17341"
  },
  {
    "id": "doc-207-_sites_g_files_vyhlif6186_f_events_2025-05-01-zba_application_docx_0_pdf",
    "title": "2025-05-01-zba_application.docx_0.pdf",
    "event": "Joint Zoning Board and Planning Board Meeting",
    "url": "https://www.ballstonspa.gov/sites/g/files/vyhlif6186/f/events/2025-05-01-zba_application.docx_0.pdf",
    "date": "2025-06-11",
    "category": "Planning Board",
    "type": "Project Document",
    "pageUrl": "https://www.ballstonspa.gov/home/events/17341"
  },
  {
    "id": "doc-208-vyhlif6186_f_events_2025-04-11t14-12-08_24pr10894_effect_finding_no_impact_1_pdf",
    "title": "2025-04-11t14-12-08_24pr10894_effect_finding_no_impact_1.pdf",
    "event": "Joint Zoning Board and Planning Board Meeting",
    "url": "https://www.ballstonspa.gov/sites/g/files/vyhlif6186/f/events/2025-04-11t14-12-08_24pr10894_effect_finding_no_impact_1.pdf",
    "date": "2025-06-11",
    "category": "Planning Board",
    "type": "Project Document",
    "pageUrl": "https://www.ballstonspa.gov/home/events/17341"
  },
  {
    "id": "doc-209-_sites_g_files_vyhlif6186_f_events_2024_l-2_0_zoning_layoutv3_0_pdf",
    "title": "2024_l-2.0_zoning_layoutv3_0.pdf",
    "event": "Joint Zoning Board and Planning Board Meeting",
    "url": "https://www.ballstonspa.gov/sites/g/files/vyhlif6186/f/events/2024_l-2.0_zoning_layoutv3_0.pdf",
    "date": "2025-06-11",
    "category": "Planning Board",
    "type": "Project Document",
    "pageUrl": "https://www.ballstonspa.gov/home/events/17341"
  },
  {
    "id": "doc-210-_sites_g_files_vyhlif6186_f_events_170_traffic_study_2025-1-27_1_pdf",
    "title": "170_traffic_study_2025-1-27_1.pdf",
    "event": "Joint Zoning Board and Planning Board Meeting",
    "url": "https://www.ballstonspa.gov/sites/g/files/vyhlif6186/f/events/170_traffic_study_2025-1-27_1.pdf",
    "date": "2025-06-11",
    "category": "Planning Board",
    "type": "Project Document",
    "pageUrl": "https://www.ballstonspa.gov/home/events/17341"
  },
  {
    "id": "doc-211-_sites_g_files_vyhlif6186_f_events_170_habitat_assessment_report_1_pdf",
    "title": "170_habitat_assessment_report_1.pdf",
    "event": "Joint Zoning Board and Planning Board Meeting",
    "url": "https://www.ballstonspa.gov/sites/g/files/vyhlif6186/f/events/170_habitat_assessment_report_1.pdf",
    "date": "2025-06-11",
    "category": "Planning Board",
    "type": "Project Document",
    "pageUrl": "https://www.ballstonspa.gov/home/events/17341"
  },
  {
    "id": "doc-212-_sites_g_files_vyhlif6186_f_events_170_env_summary_ltr_1_16_2025_1_pdf",
    "title": "170_env_summary_ltr_1.16.2025_1.pdf",
    "event": "Joint Zoning Board and Planning Board Meeting",
    "url": "https://www.ballstonspa.gov/sites/g/files/vyhlif6186/f/events/170_env_summary_ltr_1.16.2025_1.pdf",
    "date": "2025-06-11",
    "category": "Planning Board",
    "type": "Project Document",
    "pageUrl": "https://www.ballstonspa.gov/home/events/17341"
  },
  {
    "id": "doc-213-_sites_g_files_vyhlif6186_f_events_170_eaf_support_letter_2025_3_5_1_pdf",
    "title": "170_eaf_support_letter_2025.3.5_1.pdf",
    "event": "Joint Zoning Board and Planning Board Meeting",
    "url": "https://www.ballstonspa.gov/sites/g/files/vyhlif6186/f/events/170_eaf_support_letter_2025.3.5_1.pdf",
    "date": "2025-06-11",
    "category": "Planning Board",
    "type": "Project Document",
    "pageUrl": "https://www.ballstonspa.gov/home/events/17341"
  },
  {
    "id": "doc-214-_sites_g_files_vyhlif6186_f_events_6_11_25_zba___pb_agenda_pdf",
    "title": "6.11.25_zba_._pb_agenda.pdf",
    "event": "Joint Zoning Board and Planning Board Meeting",
    "url": "https://www.ballstonspa.gov/sites/g/files/vyhlif6186/f/events/6.11.25_zba_._pb_agenda.pdf",
    "date": "2025-06-11",
    "category": "Planning Board",
    "type": "Agenda",
    "pageUrl": "https://www.ballstonspa.gov/home/events/17341"
  },
  {
    "id": "doc-215-_sites_g_files_vyhlif6186_f_events_planning_board_minutes_1_8_25_-_draft_pdf",
    "title": "planning_board_minutes_1.8.25_-_draft.pdf",
    "event": "Joint Zoning Board and Planning Board Meeting",
    "url": "https://www.ballstonspa.gov/sites/g/files/vyhlif6186/f/events/planning_board_minutes_1.8.25_-_draft.pdf",
    "date": "2025-06-11",
    "category": "Planning Board",
    "type": "Minutes",
    "pageUrl": "https://www.ballstonspa.gov/home/events/17341"
  },
  {
    "id": "doc-216-6_f_events_l_-_village_of_ballston_spa_-_tannery_commons_review_-_2025_06_10_pdf",
    "title": "l_-_village_of_ballston_spa_-_tannery_commons_review_-_2025.06.10.pdf",
    "event": "Joint Zoning Board and Planning Board Meeting",
    "url": "https://www.ballstonspa.gov/sites/g/files/vyhlif6186/f/events/l_-_village_of_ballston_spa_-_tannery_commons_review_-_2025.06.10.pdf",
    "date": "2025-06-11",
    "category": "Planning Board",
    "type": "Project Document",
    "pageUrl": "https://www.ballstonspa.gov/home/events/17341"
  },
  {
    "id": "doc-217-_sites_g_files_vyhlif6186_f_events_planning_board_minutes_2_12_25_-_draft_pdf",
    "title": "planning_board_minutes_2.12.25_-_draft.pdf",
    "event": "Joint Zoning Board and Planning Board Meeting",
    "url": "https://www.ballstonspa.gov/sites/g/files/vyhlif6186/f/events/planning_board_minutes_2.12.25_-_draft.pdf",
    "date": "2025-06-11",
    "category": "Planning Board",
    "type": "Minutes",
    "pageUrl": "https://www.ballstonspa.gov/home/events/17341"
  },
  {
    "id": "doc-218-_sites_g_files_vyhlif6186_f_events_06_09_25_att_pdf",
    "title": "06.09.25_att.pdf",
    "event": "Village of Ballston Spa Board of Trustees Meeting",
    "url": "https://www.ballstonspa.gov/sites/g/files/vyhlif6186/f/events/06.09.25_att.pdf",
    "date": "2025-06-09",
    "category": "Board of Trustees",
    "type": "Project Document",
    "pageUrl": "https://www.ballstonspa.gov/home/events/15941"
  },
  {
    "id": "doc-219-_sites_g_files_vyhlif6186_f_events_agenda_06_09_25_fsr_pdf",
    "title": "agenda_06.09.25_fsr.pdf",
    "event": "Village of Ballston Spa Board of Trustees Meeting",
    "url": "https://www.ballstonspa.gov/sites/g/files/vyhlif6186/f/events/agenda_06.09.25_fsr.pdf",
    "date": "2025-06-09",
    "category": "Board of Trustees",
    "type": "Agenda",
    "pageUrl": "https://www.ballstonspa.gov/home/events/15941"
  },
  {
    "id": "doc-220-_sites_g_files_vyhlif6186_f_events_bd__mtg__05_27_25_0_pdf",
    "title": "bd._mtg._05.27.25_0.pdf",
